"title","query","authors","categories","description","published","previewLink","industryId",
"Trends in Risk Taking and Risk Reduction Among German MSM. Results of Follow-up Surveys ""gay Men and AIDS"" 1991 - 2007","intitle:risk","[Axel J. Schmidt, Michael Bochow]",,,"2009","http://books.google.es/books?id=9H4TtwAACAAJ&dq=intitle:risk&hl=&cd=625&source=gbs_api","OCLC:748700051",
"Managing interest rate risk and foreign exchange risk. disclosure of objectives, policies and processes","intitle:risk","[Andrew Marshall, Pauline Weetman]","[Interest rate risk]",,"2008","http://books.google.es/books?id=EquNtgAACAAJ&dq=intitle:risk&hl=&cd=626&source=gbs_api","OCLC:274792136",
"Risk Perceptions and Risk Management by Farmers in Burkina-Faso","intitle:risk","[Mahlon G. Lang, Michael J. Roth, Paul Preckel]","[Farm management]",,"1985","http://books.google.es/books?id=cddsHAAACAAJ&dq=intitle:risk&hl=&cd=627&source=gbs_api","OCLC:18702570",
"Alcoholic Beverage Choice, Risk Perception, and Self-reported Drunk Driving: Effects of Measurement on Risk Analysis","intitle:risk","[T. K. Greenfield, J. D. Rogers]",,,"1999","http://books.google.es/books?id=VXdLnwEACAAJ&dq=intitle:risk&hl=&cd=628&source=gbs_api","OCLC:173309579",
"Option-implied Risk-neutral Distributions and Risk Aversion","intitle:risk","[Jens Carsten Jackwerth]","[Options (Finance)]",,"2004-01-01","http://books.google.es/books?id=pUOYAAAACAAJ&dq=intitle:risk&hl=&cd=629&source=gbs_api","0943205662",
"Assessing the Predictive Validity of the Historical, Clinical, and Risk Management (HCR-20) Violence Risk Assessment Scheme with Juvenile Offenders","intitle:risk","[Lisa Forrester]","[Risk management]","Research into the administration of the Historical, Clinical, and Risk Management (HCR-20) violence risk assessment Scheme and the Australian Self-Reported Delinquency Scale (ASRDS) to assess for participation in violent behaviour. (p. xii)","2002","http://books.google.es/books?id=QUk4NAAACAAJ&dq=intitle:risk&hl=&cd=630&source=gbs_api","OCLC:225641446",
"Business Risk Management and Audit Risk 2002. (course One)","intitle:risk","[Robert N. Knechel, David O'Connor (BCom.), Institute of Chartered Accountants of New Zealand]","[Risk assessment]",,"2002","http://books.google.es/books?id=kHjEMAAACAAJ&dq=intitle:risk&hl=&cd=631&source=gbs_api","1877255947",
"Credit Risk, Interest Rate Risk and the Business Cycle","intitle:risk","[Fabio Alessandrini]",,,"1998","http://books.google.es/books?id=tIn9XwAACAAJ&dq=intitle:risk&hl=&cd=632&source=gbs_api","OCLC:716827699",
"Legal Risk and Compliance Risk in the Banking Industry in South Africa","intitle:risk","[Janet René Terblanché]",,,"2013","http://books.google.es/books?id=RxPVngEACAAJ&dq=intitle:risk&hl=&cd=633&source=gbs_api","OCLC:868057842",
"A Proposed Sector Wide Risk Model Based on Enterprise Wide Risk Management","intitle:risk","[Richard Otto Buhr]","[Risk management]",,"2008","http://books.google.es/books?id=7XaJMwEACAAJ&dq=intitle:risk&hl=&cd=634&source=gbs_api","OCLC:808091608",
"The Use of Support Group Intervention with HIV Positive and High Risk Individuals to Facilitate High Risk Behavior Change. A Thesis Submitted to the School of Social Work and Human Services ...","intitle:risk","[Colleen Sweeney DiBella]","[AIDS (Disease)]",,"1992","http://books.google.es/books?id=jnf-NwAACAAJ&dq=intitle:risk&hl=&cd=635&source=gbs_api","OCLC:29245962",
"A Note on Interest Rate Risk, Systematic Risk and the Planning Horizon","intitle:risk","[Leon J. de Man, Vrije Universiteit. Economische Faculteit]",,,"1985","http://books.google.es/books?id=RPabHAAACAAJ&dq=intitle:risk&hl=&cd=636&source=gbs_api","OCLC:64205273",
"Even Risk Averter May Love Risk","intitle:risk","[Alfred Müller, Marco Scarsini]",,,"2000","http://books.google.es/books?id=qAKeGwAACAAJ&dq=intitle:risk&hl=&cd=637&source=gbs_api","OCLC:76129036",
"2006 Financial Risk Manager Study Notes: Market risk measurement and management","intitle:risk","[Schweser Study Program]","[Credit]",,"2006","http://books.google.es/books?id=XpkKHgAACAAJ&dq=intitle:risk&hl=&cd=638&source=gbs_api","1933677090",
"Aggregate Risk and Risk Sharing Across U.S. States and Across European Countries","intitle:risk","[Marco Del Negro]",,,"1998","http://books.google.es/books?id=KLMRngEACAAJ&dq=intitle:risk&hl=&cd=639&source=gbs_api","OCLC:81195114",
"Dealing with Risk to Life and Health : an Overview of Risk Aalysis","intitle:risk","[Parayre, Roch, University of Ottawa. Faculty of Administration]",,,"1984","http://books.google.es/books?id=ZjtMNAEACAAJ&dq=intitle:risk&hl=&cd=640&source=gbs_api","OCLC:15979791",
"Enterprise risk management. I rischi aziendali e il processo di risk management","intitle:risk","[Alberto Floreani]","[Business & Economics]",,"2004","http://books.google.es/books?id=IiDgPAAACAAJ&dq=intitle:risk&hl=&cd=641&source=gbs_api","8883112792",
"Report on the Workshop on Cancer Risk Assessment Guidelines Issues, Risk Assessment Forum, U.S. Environmental Protection Agency, November 1994","intitle:risk","[United States. Environmental Protection Agency]",,,,"http://books.google.es/books?id=Nv0RtwAACAAJ&dq=intitle:risk&hl=&cd=642&source=gbs_api","OCLC:62685832",
"The Development of an Australian Health Risk Appraisal Instrument and a Pilot Study as to the Effects of Health Risk Appraisal in a University Student Population","intitle:risk",,,,"1987","http://books.google.es/books?id=gaFDOAAACAAJ&dq=intitle:risk&hl=&cd=643&source=gbs_api","OCLC:221870231",
"The Effect of Positioning on Posture and Movement in a High-risk and a Low-risk Premature Infant","intitle:risk","[Connie A. Blow]","[Dissertations, Academic]",,"1994","http://books.google.es/books?id=0JsrOAAACAAJ&dq=intitle:risk&hl=&cd=644&source=gbs_api","OCLC:31450218",
"Estimation Risk in Financial Risk Management","intitle:risk","[Peter Christoffersen, Sílvia Gonçalves, CIRANO.]",,,"2004","http://books.google.es/books?id=f71vngEACAAJ&dq=intitle:risk&hl=&cd=645&source=gbs_api","OCLC:56753274",
"The Implications of First-order Risk Aversion for Asset Market Risk Premiums","intitle:risk","[Geert Bekaert, Robert J. Hodrick, David A. Marshall]","[Rate of return]",,"1997","http://books.google.es/books?id=hbFaPgAACAAJ&dq=intitle:risk&hl=&cd=646&source=gbs_api","OCLC:36862848",
"HIV Risk Behavior and High Risk Youth. Can Audio-CASI and a Bogus Pipeline Increase the Accuracy of Reports?","intitle:risk","[Jennifer Zellner]","[HIV infections]",,"2005","http://books.google.es/books?id=zuNZNwAACAAJ&dq=intitle:risk&hl=&cd=647&source=gbs_api","OCLC:82946201",
"Proceedings of risk management in CABG, the risk management and outcome analysis series, Palm Springs, California, January 28, 1995","intitle:risk",,,,"1996","http://books.google.es/books?id=M4F1NQEACAAJ&dq=intitle:risk&hl=&cd=648&source=gbs_api","OCLC:64156608",
"An Investigation Into People's Perceptions of Risk and how Their Attitudes are Shaped by Their Political Culture and the Way in which Risk is Managed","intitle:risk","[M. Fagiano, R. Griffiths, UMIST. Chemical Engineering]",,,"1995","http://books.google.es/books?id=YrgLcgAACAAJ&dq=intitle:risk&hl=&cd=649&source=gbs_api","OCLC:643375670",
"Risk of Science Into Science of Risk. An Extraordinary Conversion","intitle:risk","[Ron Johnston]","[Technology]",,"1980","http://books.google.es/books?id=t7cWNQAACAAJ&dq=intitle:risk&hl=&cd=650&source=gbs_api","OCLC:220246025",
"Effectiveness of Sexual Offender Treatment Using Relapse Prevention Training on Sexual Offender at -risk Behaviours, Knowledge of Relapse Prevention Skills, and Self-reported Rates of Risk to Reoffend","intitle:risk","[Michelle Lee Young]","[Sex offenders]",,"2003","http://books.google.es/books?id=AxrUNwAACAAJ&dq=intitle:risk&hl=&cd=651&source=gbs_api","OCLC:52482701",
"The Risk Magazine Guide to Credit Risk. A Glossary of Terms","intitle:risk",,"[Derivative securities]",,"2003","http://books.google.es/books?id=wTfQGQAACAAJ&dq=intitle:risk&hl=&cd=652&source=gbs_api","OCLC:52535883",
"To what Extent Do Flood Risk Assessments (FRAs) Enable Development to Supersede in Flood Risk Areas. Using Lower Broughton, Salford as a Case Study?.","intitle:risk","[Sally Maguire, Iain White (Supervisor.), University of Manchester. School of Environment and Development]",,,"2006","http://books.google.es/books?id=dj0dcgAACAAJ&dq=intitle:risk&hl=&cd=653&source=gbs_api","OCLC:643529538",
"The Effect of Driver Age and Experience on Risk Assessment and Risk Prediction","intitle:risk","[Rosa DeRamus]","[Attention]",,"2005","http://books.google.es/books?id=cnlXNwAACAAJ&dq=intitle:risk&hl=&cd=654&source=gbs_api","OCLC:62591881",
"Perception of Personal Risk, Attitudes and Norms Towards Individuals with AIDS as Predictors of Risk-taking Behavior of Students at Auburn University","intitle:risk","[Dennis James Campbell]","[AIDS (Disease)]",,"1994","http://books.google.es/books?id=c0ZXOAAACAAJ&dq=intitle:risk&hl=&cd=655&source=gbs_api","OCLC:30506044",
"Moral Value, Risk and Risk Tolerance","intitle:risk","[Lennart Sjöberg, Britt-Marie Drottz-Sjöberg]",,,"1993","http://books.google.es/books?id=pkAsMwAACAAJ&dq=intitle:risk&hl=&cd=656&source=gbs_api","OCLC:186640459",
"Youths at Risk: Their Self-concepts and Youth-at-risk Transition Programs","intitle:risk","[William R. Alexander]",,,"1994","http://books.google.es/books?id=1hv-NwAACAAJ&dq=intitle:risk&hl=&cd=657&source=gbs_api","OCLC:33347331",
"International Workshop on Fire Risk Assessment and Risk-Based Fire Safety Design Method, Supported by Building Research Institute (BRI), Disaster Prevention Research Institute (DPRI) of Kyoto University and Tokyo University of Science (TUS), was Held in Kyoto, Japan on November 3, 2006. ; Special Issue","intitle:risk","[Takao Wakamatsu]",,,"2006","http://books.google.es/books?id=QN6VPgAACAAJ&dq=intitle:risk&hl=&cd=658&source=gbs_api","OCLC:255984172",
"Scoping Study on Public Perception of Risk and EP Risk Communication","intitle:risk","[Great Britain. Environment Agency, P. Orr]",,,"2002","http://books.google.es/books?id=gSQkygAACAAJ&dq=intitle:risk&hl=&cd=659&source=gbs_api","1857059123",
"Project Risk Optimization Based on Strategy-proof Risk Assessment","intitle:risk","[Yaniv Mordecai]",,,"2010","http://books.google.es/books?id=iW0CywAACAAJ&dq=intitle:risk&hl=&cd=660&source=gbs_api","OCLC:713940626",
"Public Stakeholder Research for Human Health Risk and Risk Management at Federal Facilities and Formerly Used Defense Sites in Alaska. Final Report","intitle:risk","[University of Alaska Anchorage. Environment and Natural Resources Institute, United States. Federal Facilities Restoration and Reuse Office]","[Hazardous waste site remediation]",,"2001","http://books.google.es/books?id=_wOmSgAACAAJ&dq=intitle:risk&hl=&cd=661&source=gbs_api","OCLC:54086339",
"Perception of Risk of Heart Disease in Comparison to Actual Risk in College Females","intitle:risk","[Samantha Hirth]",,,"2010","http://books.google.es/books?id=mjH_ewEACAAJ&dq=intitle:risk&hl=&cd=662&source=gbs_api","OCLC:703669064",
"The Cross-section of Foreign Currency Risk Premia and Consumption Growth Risk","intitle:risk","[Hanno Lustig, Adrien Verdelhan]","[Asset pricing]",,"2006","http://books.google.es/books?id=09ftNwAACAAJ&dq=intitle:risk&hl=&cd=663&source=gbs_api","OCLC:75980861",
"Environmental Exposures During Perinatal Development [microform] : Methods of Risk Examination Including Chemical Measurement for Environmental Tobacco Smoke Exposure, and Meta-analysis and Risk Assessment for Organic Solvent Exposure","intitle:risk","[Kristen Ingrid McMartin]",,,"2002","http://books.google.es/books?id=3W-EtgAACAAJ&dq=intitle:risk&hl=&cd=664&source=gbs_api","0612692191",
"Risk and Risk Management in Public/private Sector Real Estate Development. The Development of Tin House Court","intitle:risk","[Peter D. McCourt]","[Real estate development]",,"1989","http://books.google.es/books?id=3U3uNwAACAAJ&dq=intitle:risk&hl=&cd=665&source=gbs_api","OCLC:74378253",
"HIV/AIDS Transmission Knowledge, Risk Behaviors, Attitudes and Perceptions of Risk Among African-American College Students","intitle:risk","[Paulette L. Johnson]","[AIDS (Disease)]",,"2000","http://books.google.es/books?id=ZE9SOAAACAAJ&dq=intitle:risk&hl=&cd=666&source=gbs_api","OCLC:48261688",
"Postpartum Posttraumatic Stress as a Risk Factor for Atypical Cognitive Development in High-risk Infants","intitle:risk","[Francella A. Quinnell]","[Neonatal intensive care]",,"2001","http://books.google.es/books?id=oSaYNwAACAAJ&dq=intitle:risk&hl=&cd=667&source=gbs_api","OCLC:49244561",
"Risk-taking-neutral Background Risk","intitle:risk","[Günter Franke, Harris Schlesinger, Richard C. Stapleton]",,,"2013","http://books.google.es/books?id=9r1tmAEACAAJ&dq=intitle:risk&hl=&cd=668&source=gbs_api","OCLC:827779949",
"Special Issue: From Risk Assessment to Risk Response","intitle:risk","[Hossein Nezakati]",,,"2011","http://books.google.es/books?id=TBRGmwEACAAJ&dq=intitle:risk&hl=&cd=669&source=gbs_api","OCLC:838075436",
"Inflation Risk and Default Risk in a Dynamic General Equilibrium Asset Pricing Model for an Emerging Market Economy","intitle:risk","[M. Fatih Ekinci]","[Capital assets pricing model]",,"2002","http://books.google.es/books?id=-QUmHQAACAAJ&dq=intitle:risk&hl=&cd=670&source=gbs_api","OCLC:50745552",
"Risk Assessment and Risk Management Plans for Dealings Involving Intentional Release of Genetically Modified Canola DIR 010/2001 and DIR 011/2001","intitle:risk",,"[Canola]",,"2002","http://books.google.es/books?id=FAtsNQAACAAJ&dq=intitle:risk&hl=&cd=671&source=gbs_api","OCLC:223436169",
"Credit Risk and the Pricing of Credit Risk Derivatives","intitle:risk","[Glenn Alexander Brickhill]","[Derivative securities]",,"2000","http://books.google.es/books?id=xGYgMwEACAAJ&dq=intitle:risk&hl=&cd=672&source=gbs_api","OCLC:775696664",
"Concurrent Validity and Accuracy of Prediction of Three Preschool Screening Instruments in Determining Kindergarten Children who are At-risk and Not At-risk for Cognitive Delays","intitle:risk","[Marion Brannon Duncan]","[Educational tests and measurements]",,"1989","http://books.google.es/books?id=67CUtgAACAAJ&dq=intitle:risk&hl=&cd=673&source=gbs_api","OCLC:20848415",
"A Comparison of Awareness of Cardiovascular Risk Factors and Perception of Personal Risk Between the General Public and the Relatives of Sudden Cardiac Death Victims","intitle:risk","[Kathleen Haugland Hinson]",,,"1989","http://books.google.es/books?id=apjgNwAACAAJ&dq=intitle:risk&hl=&cd=674&source=gbs_api","OCLC:21479397",
"Behavioral Differences Between High Risk Pregnant Women and Low Risk Pregnant Women and the Implications for Social Work Services","intitle:risk","[Beverly Ann Burgess, Timothy George Jeffrey, Frankie Lynn Smith, Claudia Anne Strange]","[Medical social work]",,"1976","http://books.google.es/books?id=ZD60NwAACAAJ&dq=intitle:risk&hl=&cd=676&source=gbs_api","OCLC:2714111",
"Review of Ecological Risk Assessment Case Studies from a Risk Assessment Perspective","intitle:risk",,"[Environmental protection]",,"1993","http://books.google.es/books?id=nEElHQAACAAJ&dq=intitle:risk&hl=&cd=677&source=gbs_api","OCLC:28815948",
"An Approach to Risk Reduction and Risk Management for Cardiovascular Disease and Type 2 Diabetes with Nurse Leadership in Primary Health Care","intitle:risk","[Margaret Horsburgh, Felicity.. Goodyear-Smith, Julie Yallop, Auckland UniServices, New Zealand. Ministry of Health, University of Auckland. School of Population Health, University of Auckland. Division of Nursing]","[Cardiovascular system]",,"2007","http://books.google.es/books?id=krxAngEACAAJ&dq=intitle:risk&hl=&cd=678&source=gbs_api","OCLC:814282386",
"Risk Benefit Analysis of Moderate Alcohol Consumption and Characterisation of Persons with Increased Alcohol Associated Health Risk in Germany","intitle:risk",,,,"2003","http://books.google.es/books?id=tgpuAAAACAAJ&dq=intitle:risk&hl=&cd=679&source=gbs_api","3898739538",
"Foreign Investment in China's Development with Particular Reference to Risk and Risk Analysis","intitle:risk","[Rolexe Chi Pang Chan, University of Newcastle upon Tyne. Department of Economics]",,,"1998","http://books.google.es/books?id=8NC1HAAACAAJ&dq=intitle:risk&hl=&cd=680&source=gbs_api","OCLC:40136437",
"The Relationship of a Risk Intervention Program in Altering Risk Behavior in Hospital Personnel","intitle:risk","[Carole A. Schultz]","[Hospitals]",,"1981","http://books.google.es/books?id=AuZLNwAACAAJ&dq=intitle:risk&hl=&cd=681&source=gbs_api","OCLC:9211932",
"Traffic Noise and Cardiovascular Risk. The Caerphilly Study, First Phase. Outdoor Noise Levels and Risk Factors","intitle:risk","[Wolfgang Babisch, P. C. Elwood, J. E. J. Gallacher, Hartmut Ising]",,,"1988","http://books.google.es/books?id=mtzrnQEACAAJ&dq=intitle:risk&hl=&cd=682&source=gbs_api","OCLC:173453007",
"Risk Management Series, Insurance, Finance, and Regulation Primer for Terrorism Risk Management in Buildings, FEMA 429, December 2003","intitle:risk",,,,"2004*","http://books.google.es/books?id=J0ZYngEACAAJ&dq=intitle:risk&hl=&cd=683&source=gbs_api","OCLC:60983692",
"The Relationship Between Risk Involvement and Risk Perception Among Adolescents","intitle:risk","[Rebecca Jean Johnson]","[Risk perception]",,"1999","http://books.google.es/books?id=EpQrOAAACAAJ&dq=intitle:risk&hl=&cd=684&source=gbs_api","OCLC:44039113",
"The Influences of Inherent Risk and Information Acquisition on Consumer Risk Reduction Strategies","intitle:risk","[Geoffrey Paul Lantos]","[Brand choice]",,"1980","http://books.google.es/books?id=_N3OnQEACAAJ&dq=intitle:risk&hl=&cd=685&source=gbs_api","OCLC:15541838",
"Attitudinal Differences Between High School Students at Risk and High School Students Not at Risk","intitle:risk","[William A. Quinn]","[High school students]",,"1996","http://books.google.es/books?id=vv72tgAACAAJ&dq=intitle:risk&hl=&cd=686&source=gbs_api","OCLC:36217352",
"Risk and Return in the Canadian Mining Industry - 1 - Profits in the Canadian Mining Industry - 2 - Risk in the Canadian Mining Industry","intitle:risk","[Queen's University (Kingston, Ont.). Centre for Resource Studies, Micromedia Limited]","[Mines and mineral resources]",,"1977","http://books.google.es/books?id=iQQGcgAACAAJ&dq=intitle:risk&hl=&cd=687&source=gbs_api","OCLC:630027440",
"The Impact of Risk Perception and Risk Attitudes on Corrupt Behavior. Evidence from a Petty Corruption Experiment","intitle:risk","[Behnud Mir Djawadi, René Fahr]",,,"2013","http://books.google.es/books?id=yV5OnQEACAAJ&dq=intitle:risk&hl=&cd=688&source=gbs_api","OCLC:843879339",
"Risk Factors for Catheter Colonization in High Risk Infants with Percutaneous Central Venous Catheters","intitle:risk","[Mary Kay Chathas]",,,"1991","http://books.google.es/books?id=k5rLtgAACAAJ&dq=intitle:risk&hl=&cd=689&source=gbs_api","OCLC:25763341",
"Risk Factors for Heart Disease in Rural Women as Determined by Health Risk Assessment","intitle:risk","[Molly Parsons]","[Cardiovascular system]",,"1996","http://books.google.es/books?id=R2EHOAAACAAJ&dq=intitle:risk&hl=&cd=690&source=gbs_api","OCLC:36176632",
"Environmental Aspects of Risk Assessment and Risk Management for Metals","intitle:risk","[S. D. (Stuart) Dobson, International Council on Metals in the Environment]",,,"1997","http://books.google.es/books?id=AdawXwAACAAJ&dq=intitle:risk&hl=&cd=691&source=gbs_api","OCLC:704088483",
"Risk Shifting Versus Risk Management. Investment Policy in Corporate Pension Plans","intitle:risk","[Joshua Rauh]","[Defined benefit pension plans]","The asset allocation of defined benefit pension plans is a setting where both risk shifting and risk management incentives are likely be present. Empirically, firms with poorly funded pension plans and weak credit ratings allocate a greater share of pension fund assets to safer securities such as government debt and cash, whereas firms with well-funded pension plans and strong credit ratings invest more heavily in equity. These relations hold both in the cross-section and within firms and plans over time. The incentive to limit costly financial distress plays a considerably larger role than risk shifting in explaining variation in pension fund investment policy among U.S. firms.","2007","http://books.google.es/books?id=iMdxcgAACAAJ&dq=intitle:risk&hl=&cd=692&source=gbs_api","OCLC:163308687",
"Risk Assessment and Risk Communication Strategies in Bioterrorism Preparedness (2007).","intitle:risk",,,,,"http://books.google.es/books?id=QtmMNQEACAAJ&dq=intitle:risk&hl=&cd=693&source=gbs_api","OCLC:785032910",
"Design, Pricing, Risk Measurement and Risk Mangement of Life Insurance Products","intitle:risk","[Jochen Ruß]","[Life insurance]",,"2009","http://books.google.es/books?id=KeZRngEACAAJ&dq=intitle:risk&hl=&cd=694&source=gbs_api","OCLC:859528429",
"Lands at Risk, People at Risk. Perspectives on Tropical Forest Transformation in the Philippines","intitle:risk","[James N. Anderson, Institute for Development Anthropology (Binghamton, N.Y.)]","[Clearing of land]",,"1985*","http://books.google.es/books?id=kipTPQAACAAJ&dq=intitle:risk&hl=&cd=695&source=gbs_api","OCLC:32693117",
"Effects of Bullying on Students Emotional Health and Possible Risk of Development of at Risk Behavior","intitle:risk","[Margaret A. Zagorski, Governors State University. College of Arts and Sciences]","[Aggressiveness]",,"2010","http://books.google.es/books?id=xepxMwEACAAJ&dq=intitle:risk&hl=&cd=696&source=gbs_api","OCLC:814296332",
"The 'Risk-wise' Risk Management Planning Process","intitle:risk","[Carpenter]",,"From The ""Risk-Wise"" Investor, this chapter takes you through a step-by-step process to effectively manage risk. This risk planning strategy is dedicated to helping you become familiar and completely comfortable with an easy-to-use, very effective, and holistic risk management planning process. It's a system that you can put to work right away in preparing for and effectively managing the risks you'll face. Author and industry veteran Michael Carpenter believes the key to risk management is to recognize that business and financial phenomenon exists and to factor it into your investment thinking. This chapter demystifies risk management, covering: Portfolio strategies for all market conditions Active and Passive risk management strategies Risk Assessment Decision Making Checklists","2011-01-05","http://books.google.es/books?id=WYa1uAAACAAJ&dq=intitle:risk&hl=&cd=697&source=gbs_api","1118108434",
"Consistent Modeling of Risk Averse Behavior with Spectral Risk Measures","intitle:risk","[Hans Peter Wächter, Thomas Mazzoni]",,,"2010","http://books.google.es/books?id=90CAngEACAAJ&dq=intitle:risk&hl=&cd=698&source=gbs_api","OCLC:682108740",
"Risk-based Capital Requirements and Risk-based FDIC Insurance Premiums. An Analysis of the Arguments","intitle:risk","[Carlton A. Klinger]",,,"1989","http://books.google.es/books?id=QsklPwAACAAJ&dq=intitle:risk&hl=&cd=699&source=gbs_api","OCLC:299286919",
"Risk Management, Risk Measurement","intitle:risk",,"[Investments]",,"1996","http://books.google.es/books?id=wHdHtwAACAAJ&dq=intitle:risk&hl=&cd=700&source=gbs_api","OCLC:77013910",
"Generating a Superior Risk and Return Profile in a Multi-asset Structure by Actively Deploying Risk Indicator","intitle:risk","[John Byrne]",,,"2012","http://books.google.es/books?id=SqellAEACAAJ&dq=intitle:risk&hl=&cd=701&source=gbs_api","OCLC:822743183",
"The Potential for Compassion Satisfaction, Risk of Compassion Fatigue and Risk of Burnout in Nurses","intitle:risk","[Karen Marie Sarnosky]","[Nurses]",,"2000","http://books.google.es/books?id=PGLiHAAACAAJ&dq=intitle:risk&hl=&cd=702&source=gbs_api","OCLC:65172972",
"International Workshop on Fire Risk Assessment and Risk Based Fire Safety Design Method","intitle:risk",,,,"2006","http://books.google.es/books?id=gJorMwEACAAJ&dq=intitle:risk&hl=&cd=703&source=gbs_api","OCLC:500318191",
"Univariate and Multivariate Measures of Risk Aversion and Risk Premiums with Joint Normal Distribution and Applications in Portfolio Selection Models [microform]","intitle:risk","[Yuming Li]","[Portfolio management]",,"1987","http://books.google.es/books?id=SD6BZwEACAAJ&dq=intitle:risk&hl=&cd=704&source=gbs_api","OCLC:20251042",
"Risk Taking and Risk Sharing Does Responsibility Matter?","intitle:risk","[Elena Cettolin, Franzisca Tausch]",,,"2013","http://books.google.es/books?id=q90YnwEACAAJ&dq=intitle:risk&hl=&cd=705&source=gbs_api","OCLC:856631320",
"Family Violence Risk Assessment and Risk Management Framework and Practice Guides 1-3","intitle:risk",,"[Family violence]","""This manual aims to support a consistent approach for assessing and managing family. It consists of three key elements: the framework, contextual information necessary to use the framework effectively, and, practice guides 1 to 3""--Introduction.","2012","http://books.google.es/books?id=SCbzngEACAAJ&dq=intitle:risk&hl=&cd=706&source=gbs_api","0731163532",
"Risk Free to Risk Taking Developing the Renaissance Manager","intitle:risk","[James G. Cosgrove, Ubiratan N. Guzzi]",,,"1985","http://books.google.es/books?id=ofPSygAACAAJ&dq=intitle:risk&hl=&cd=707&source=gbs_api","OCLC:14234510",
"A Risk Analysis and Risk Management Methodology for Mitigating Wireless Local Area Networks (WLANs) Intrusion Security Risks","intitle:risk","[Hanifa Abdullah]","[Computer networks]",,"2006","http://books.google.es/books?id=0Zw_nQEACAAJ&dq=intitle:risk&hl=&cd=708&source=gbs_api","OCLC:74298778",
"Compensating Wage Differentials for Workplace Risk and Background Risk","intitle:risk","[Feng Liu]","[Life expectancy]",,"2003","http://books.google.es/books?id=SI0VtwAACAAJ&dq=intitle:risk&hl=&cd=709&source=gbs_api","OCLC:54388141",
"The Role of Risk Analysis and Risk Management in Environmental Protection","intitle:risk","[Linda-Jo Schierow]",,,"2005","http://books.google.es/books?id=FzrungEACAAJ&dq=intitle:risk&hl=&cd=710&source=gbs_api","OCLC:47779778",
