"title","query","authors","categories","description","published","previewLink","industryId",
"Acceptable Risk","risk","[Robin Cook]","[Fiction]","The author of Chromosome 6 presents another thriller that gives readers an unsettling glimpse into the dangers of antidepressant drugs and tackles the ethics involved in such personality-altering medications as Prozac. Reissue.","1996-01-01","http://books.google.es/books?id=M1ASvnvApW4C&printsec=frontcover&dq=risk&hl=&cd=15&source=gbs_api","0425151867",
"Risk Management. Survival Tools for Law Firms","risk","[Anthony E. Davis, Peter R. Jarvis]","[Law]","Risk Management: Survival Tools for Law Firms helps law firms establish solid policies, procedures, and systems to minimize risk and become more efficient. This completely revised second edition and accompanying CD-ROM provides a comprehensive overview of risk management, offers a practical approach to risk management evaluation, and explains the steps to take to create a best practice plan.","2007","http://books.google.es/books?id=J-XvV381eacC&printsec=frontcover&dq=risk&hl=&cd=16&source=gbs_api","1590318536",
"The Great Risk Shift : The Assault on American Jobs, Families, Health Care and Retirement And How You Can Fight Back. The Assault on American Jobs, Families, Health Care and Retirement And How You Can Fight Back","risk","[Jacob S. Hacker Professor of Political Science Yale University]","[Political Science]","America's leaders say the economy is strong and getting stronger. But ordinary Americans aren't buying it. They see what the rosy statistics hide: We are all struggling under the weight of terrifying economic instability. No matter how well educated and hard working we are, we know that the bottom can fall out at any moment. Meanwhile, the safety net that once protected us is fast unraveling. With retirement plans in growing jeopardy while health coverage erodes, more and more economic risk is shifting from government and business onto the fragile shoulders of the American family. In The Great Risk Shift, Jacob S. Hacker lays bare this unsettling new economic climate, showing how it has come about, what it is doing to our families, and how we can fight back. Behind this shift, he contends, is the Personal Responsibility Crusade, eagerly embraced by corporate leaders and Republican politicians who speak of a nirvana of economic empowerment, an ""ownership society"" in which Americans are free to choose. But as Hacker reveals, the result has been quite different: a harsh new world of economic insecurity, in which far too many Americans are free to lose. The book documents how two great pillars of economic security--the family and the workplace--guarantee far less financial stability than they once did. The final leg of economic support--the public and private benefits that workers and families get when economic disaster strikes--has dangerously eroded as political leaders and corporations increasingly cut back protections of our health care, our income security, and our retirement pensions. Hacker concludes by advocating an ""insurance and opportunity society"" that would safeguard economic security and expand economic opportunity, ensuring that all Americans have the basic financial security they need to reach for and achieve the American Dream. Jacob Hacker brings into focus as never before the pressures that the Great Risk Shift exerts on our pocketbooks and on our lives. Blending powerful human stories, big-picture analysis, and compelling ideas for reform, this remarkable volume will hit a nerve, serving as a rallying point in the vital struggle for economic security in an increasingly uncertain world.","2006-10-09","http://books.google.es/books?id=2k_zwHl3PAAC&printsec=frontcover&dq=risk&hl=&cd=17&source=gbs_api","9780199726639",
"Megaprojects and Risk. An Anatomy of Ambition","risk","[Bent Flyvbjerg, Nils Bruzelius, Werner Rothengatter]","[Business & Economics]","A fascinating account of the problems and possible solutions involved in managing megaprojects.","2003-02-13","http://books.google.es/books?id=RAV5P-50UjEC&printsec=frontcover&dq=risk&hl=&cd=18&source=gbs_api","0521009464",
"Against the Gods. The Remarkable Story of Risk","risk","[Peter L. Bernstein]","[Business & Economics]","A Business Week, New York Times Business, and USA Today Bestseller ""Ambitious and readable . . . an engaging introduction to the oddsmakers, whom Bernstein regards as true humanists helping to release mankind from the choke holds of superstition and fatalism."" -The New York Times ""An extraordinarily entertaining and informative book."" -The Wall Street Journal ""A lively panoramic book . . . Against the Gods sets up an ambitious premise and then delivers on it."" -Business Week ""Deserves to be, and surely will be, widely read."" -The Economist ""[A] challenging book, one that may change forever the way people think about the world."" -Worth ""No one else could have written a book of such central importance with so much charm and excitement."" -Robert Heilbroner author, The Worldly Philosophers ""With his wonderful knowledge of the history and current manifestations of risk, Peter Bernstein brings us Against the Gods. Nothing like it will come out of the financial world this year or ever. I speak carefully: no one should miss it."" -John Kenneth Galbraith Professor of Economics Emeritus, Harvard University In this unique exploration of the role of risk in our society, Peter Bernstein argues that the notion of bringing risk under control is one of the central ideas that distinguishes modern times from the distant past. Against the Gods chronicles the remarkable intellectual adventure that liberated humanity from oracles and soothsayers by means of the powerful tools of risk management that are available to us today. ""An extremely readable history of risk."" -Barron's ""Fascinating . . . this challenging volume will help you understand the uncertainties that every investor must face."" -Money ""A singular achievement."" -Times Literary Supplement ""There's a growing market for savants who can render the recondite intelligibly-witness Stephen Jay Gould (natural history), Oliver Sacks (disease), Richard Dawkins (heredity), James Gleick (physics), Paul Krugman (economics)-and Bernstein would mingle well in their company."" -The Australian","2012-09-11","http://books.google.es/books?id=G5TKA6B0pyEC&printsec=frontcover&dq=risk&hl=&cd=19&source=gbs_api","9780470534533",
"Risk. analysis, assessment, management","risk","[Jake Ansell, Frank Wharton]","[Business & Economics]","Noted authorities address some of the more important and difficult aspects of risk management using a variety of contexts in order to contribute to the creation of a conceptual framework for thinking about risk. Coverage includes prospects of risk analysis, assessment and management ranging from methodology to ethics with examples drawn from industry, finance, transport, health and the environment.","1992","http://books.google.es/books?id=N0K5AAAAIAAJ&q=risk&dq=risk&hl=&cd=20&source=gbs_api","047193464X",
"Risk Society. Towards a New Modernity","risk","[Ulrich Beck]","[Political Science]","Western industrial society is widely seen to be going through a decisive transitional period into a form defined variously as ""post-Englightenment"", ""post-Fordist"" or ""postmodern"". Arguing that we are instead facing a different modernity typified by reflexivity, the author goes beyond these description to provide a coherent picture of the direction of gobal social change. Underpinning the analysis is the notion of the ""risk society"". The author develops an overview of other key elements of current social development : the centrality of the political economy of knowledge ; the changing roles of class and gender in a new work environment; and the politics of the risk society. (Adapté du résumé de l'éditeur).","1992-09-03","http://books.google.es/books?id=W2sDTHaSiiYC&printsec=frontcover&dq=risk&hl=&cd=21&source=gbs_api","0803983468",
"The Rhetoric of Risk. Technical Documentation in Hazardous Environments","risk","[Beverly A. Sauer]","[TECHNOLOGY & ENGINEERING]","The crash of an Amtrak train near Baltimore, the collapse of the Hyatt hotel in Kansas City, the incident at Three Mile Island, and other large-scale technological disasters have provided powerful examples of the ways that communication practices influence the events and decisions that precipitate a disaster. These examples have raised ethical questions about the responsibility of writers within agencies, epistemological questions about the nature of representation in science, and rhetorical questions about the nature of expertise and experience as grounds for judgments about risk. In The Rhetoric of Risk: Technical Documentation in Hazardous Environments, author Beverly Sauer examines how the dynamic uncertainty of the material environment affects communication in large regulatory industries. Sauer's analysis focuses specifically on mine safety, which provides a rich technical and historical context where problems of rhetorical agency, narrative, and the negotiation of meaning have visible and tragic outcomes. But the questions Sauer asks have larger implication for risk and safety: How does writing function in large regulatory industries? What can we learn from experience? Why is this experience so difficult to capture in writing? What information is lost when agencies rely on written documentation alone? Given the uncertainties, how can we work to improve communication in hazardous and uncertain environments? By exploring how individuals make sense of the material, technical, and institutional indeterminancies of their work in speech and gesture, The Rhetoric of Risk helps communicators rethink their frequently unquestioned assumptions about workplace discourse and the role of writers in hazardous worksites. It is intended for scholars and students in technical writing and communication, rhetoric, risk analysis and risk communication, as well as a wide range of engineering and technical fields concerned with risk, safety, and uncertainty.","2003-01-30","http://books.google.es/books?id=MpEAoMcFNJ8C&printsec=frontcover&dq=risk&hl=&cd=23&source=gbs_api","9781135654870",
"Stress, Risk, and Resilience in Children and Adolescents. Processes, Mechanisms, and Interventions","risk","[Robert J. Haggerty]","[Medical]","Many children's behavioral problems have multiple causes, and most children with one problem behavior also have others. The co-occurence and interrelatedness of risk factors and problem behavior is certainly an important area of research. This volume recognizes the complexity of the developmental processes that influence coping and resilience and the roles sociocultural factors play. The contributors focus on four themes that have emerged in the study of risk and coping over the past decade: interrelatedness of risk and problems, individual variability in resilience and susceptibility to stress, processes and mechanisms linking multiple stressors to multiple outcomes, and interventions and prevention. Psychologists, pediatricians, and others involved in the research or care of children will take great interest in this text.","1996-09-28","http://books.google.es/books?id=px9c4-2qHjAC&printsec=frontcover&dq=risk&hl=&cd=24&source=gbs_api","0521576628",
"Understanding and Managing Risk Attitude","risk","[Dr David Hillson, Ms Ruth Murray-Webster]","[Business & Economics]","David Hillson's and Ruth Murray-Webster's Understanding and Managing Risk Attitude will help you understand the human aspects of risk management and to manage proactively the influence of human behaviour on the risk process. The authors introduce a range of models, perspectives and examples to define and detail the range of possible risk attitudes; looking both at individuals and groups. Using leading-edge thinking on self-awareness and emotional literacy they develop a powerful approach to address the most common shortfall in current risk management: the failure to manage the human aspects of the process.","2012-03-01","http://books.google.es/books?id=jnCfhHpD1LwC&printsec=frontcover&dq=risk&hl=&cd=25&source=gbs_api","9781409450504",
"Handbook of Adolescent Health Risk Behavior","risk","[Ralph J. DiClemente, William B. Hansen, Lynn E. Ponton]","[Medical]","This reference provides a comprehensive assessment of adolescent health risk behaviors - such as smoking, violence, teen pregnancy, and AIDS among many others. Experts describe trends and changes in risk behaviors over time; illustrate theoretical models useful for understanding adolescent risk-taking behavior and developing preventive interventions; review the state-of-the-science with respect to prevention strategies for each risk behavior; and identify effective treatment modalities.","1996-01-31","http://books.google.es/books?id=DoSU8Xo_ahQC&printsec=frontcover&dq=risk&hl=&cd=26&source=gbs_api","0306451476",
"Reputational Risk. A Question of Trust","risk","[Derek Atkins, Lynn Drennan, Ian Bates]","[Business & Economics]","* Published in association with the Risk Management Association of the USA (RMA), the Association of Insurance and Risk Managers (AIRMIC), and the Institute of Risk Management (IRM), * Will stimulate the thinking of executives and leave them wanting to do something about it (and give them the means to start) * A topical, and increasingly important, issue reflected in recent scandals (Enron, Marconi), government responses (e.g. the Combined Code in the UK), and the continuing growth in consumerism An organization's own reputation is a valuable asset that is often insufficiently managed, if it is managed at all. This book not only outlines its importance, but it presents a new and insightful definition of the risk and proposes an approach for managing it properly. For the first time, a whole range of current issues (scandals and frauds, government legislation on risk management and reporting, the growth of consumerism, etc.) is targeted in a single logical argument on how to deal with it. Aimed at directors and senior executives, professional risk managers, consultants and professional risk advisers, and students in advanced courses.","2006","http://books.google.es/books?id=nYKcK9IlphgC&printsec=frontcover&dq=risk&hl=&cd=27&source=gbs_api","0852977638",
"Risk, Uncertainty and Profit","risk","[Frank H. Knight]","[Business & Economics]","One of the twentieth century's most influential economics texts, Risk, Uncertainty and Profit provided the theoretical basis of the entrepreneurial American economy during the post-industrial era. This revolutionary work taught the world how to systematically distinguish between risk (randomness with knowable probabilities), and uncertainty (randomness with unknowable probabilities), in order to accurately and properly ascertain a venture's potential profitability. Author Frank H. Knight's methodology served as the foundation of the Chicago School of Economics, maintaining that competition in a free market economy is the best method for achieving economic health. In this 1921 book, Knight explains why perfect competition would not necessarily eliminate profits, because of ""uncertainty,"" rather than ""risk."" He contends that even in long-run equilibrium, entrepreneurs would earn profits as a return for their toleration of uncertainty. Knight's reasoning remains valid in the twenty-first century, and his definitions of risk and uncertainty continue to be taught in modern economics classes. Sociologist Edward Shils declared Risk, Uncertainty and Profit ""a brilliant book,"" noting its interest not only to economists but also to social philosophers, sociologists, game theorists, and other specialists in social science.","2012-03-09","http://books.google.es/books?id=LFsVFS3OG_gC&printsec=frontcover&dq=risk&hl=&cd=28&source=gbs_api","9780486147932",
"Quantitative Risk Management. Concepts, Techniques, and Tools","risk","[Alexander J. McNeil, Rüdiger Frey, Paul Embrechts]","[Business & Economics]","The implementation of sound quantitative risk models is a vital concern for all financial institutions, and this trend has accelerated in recent years with regulatory processes such as Basel II. This book provides a comprehensive treatment of the theoretical concepts and modelling techniques of quantitative risk management and equips readers--whether financial risk analysts, actuaries, regulators, or students of quantitative finance--with practical tools to solve real-world problems. The authors cover methods for market, credit, and operational risk modelling; place standard industry approaches on a more formal footing; and describe recent developments that go beyond, and address main deficiencies of, current practice. The book's methodology draws on diverse quantitative disciplines, from mathematical finance through statistics and econometrics to actuarial mathematics. Main concepts discussed include loss distributions, risk measures, and risk aggregation and allocation principles. A main theme is the need to satisfactorily address extreme outcomes and the dependence of key risk drivers. The techniques required derive from multivariate statistical analysis, financial time series modelling, copulas, and extreme value theory. A more technical chapter addresses credit derivatives. Based on courses taught to masters students and professionals, this book is a unique and fundamental reference that is set to become a standard in the field.","2010-09-02","http://books.google.es/books?id=vgy98mM9zQUC&printsec=frontcover&dq=risk&hl=&cd=29&source=gbs_api","9781400837571",
"Adolescence, Risk and Resilience. Against the Odds","risk","[John Coleman, Ann Hagell]","[Psychology]","Adolescence is often portrayed as an age of particular risk. Adolescents are not only considered a risk to themselves, but also to the rest of society. As a society, we are nervous of them, and consider them vulnerable, yet the seeds of successful and independent adult life are laid down in adolescence, and they need all the help and support that they can get at a challenging time. Adolescents at Risk: Against the Odds looks in depth at some of the key risks faced by adolescents, and at some of the ways in which they can be alleviated. The book is structured according to the operational challenges the research informs.","2007-12-17","http://books.google.es/books?id=548tCXJGljkC&printsec=frontcover&dq=risk&hl=&cd=30&source=gbs_api","9780470025024",
"Adolescents and risk. Behaviors, functions and protective factors","risk","[Silvia Bonino, Elena Cattelino, Silvia Ciairano]","[Business & Economics]","The volume provides a substantial contribution to the understanding of adolescent risk behavior, informative and useful for both scientists and practitioners. The chapters deal with each of the key risk behaviors that are of concern at this developmental stage: tobacco smoking, alcohol use, marijuana and other drugs use, precocious and unprotected sexual behavior, eating disorders, risky behavior, risky driving, deviant and antisocial behavior. The book combines theoretical analysis and the findings of a wide research project, where the multiple contexts in the ecology of daily adolescent life have been considered. The data are based on large normative samples and the presentation of findings is very accessible, relying throughout on graphic representation rather than statistical tables. The book describes the different risk behaviors, shows the linkages between them, and explains the functions served by the various risk behaviors or the meanings they may have for the adolescent. It examines how they vary with age, sex, and other demographic characteristics, and demonstrates the influential role the theoretical risk factors and protective factors play in adolescent risk behavior involvement. The research findings not only strengthen the theory, but serve as an important guide to the design of intervention efforts to prevent or reduce adolescent involvement in risk behavior. The authors emphasize the need to strengthen protective factors that can promote positive development, and the need to provide opportunities for behaviors that can serve the same purposes as risk behaviors do, but without compromising health and development. This is the key challenge for all western contemporary societies.","2006-01-16","http://books.google.es/books?id=Bm0oNNvpAzAC&printsec=frontcover&dq=risk&hl=&cd=31&source=gbs_api","9788847003934",
"Reporting on Risk. How the Mass Media Portray Accidents, Diseases, Other Hazards","risk","[Eleanor Singer, Phyliss M. Endreny]","[Business & Economics]","After acts of airline terrorism, air travel tends to drop dramaticallyyet Americans routinely pursue the far riskier business of driving cards, where accidents resulting in death or injury are much more likely to occur. Reporting on Risk argues that this selective concern with danger is powerfully shaped by the media, whose coverage of potentially hazardous events is governed more by a need to excite the public than to inform it. Singer and Endreny survey a wide range of print and electronic media to provide an unprecedented look at how hundreds of different hazards are presented to the publicfrom toxic waste and food poisoning to cigarette smoking, from transportation accidents to famine, and from experimental surgery to communicable diseases. Their investigations raise thought-provoking questions about what the media tell us about modern risks, which hazards are covered and which ignored, and how the media determine when hazards should be considered risky. Are natural hazards reported differently than man-made hazards? Is greater emphasis placed on the potential benefits or the potential drawbacks of complex new technologies? Are journalists more concerned with reporting on unproven cures or informing the public about preventative measures? Do newspapers differ from magazines and television in their risk reporting practices? Reporting on Risk examines the accuracy and the amount of information we receive about our environment. It offers a critical perspective on how our perceptions of risk, as shaped by the media, may contribute to misguided individual and public choices for action and prevention in an increasingly complex world. The authors' probing assessment of how the media report a vast array of risks offers insights useful to journalists, policy analysts, risk specialists, legislators, and concerned citizens.","1993-05-18","http://books.google.es/books?id=rfwyIIGQpsEC&printsec=frontcover&dq=risk&hl=&cd=32&source=gbs_api","0871548011",
"Credit Risk: Modeling, Valuation and Hedging","risk","[Tomasz R. Bielecki, Marek Rutkowski]","[Business & Economics]","The main objective of Credit Risk: Modeling, Valuation and Hedging is to present a comprehensive survey of the past developments in the area of credit risk research, as well as to put forth the most recent advancements in this field. An important aspect of this text is that it attempts to bridge the gap between the mathematical theory of credit risk and the financial practice, which serves as the motivation for the mathematical modeling studied in the book. Mathematical developments are presented in a thorough manner and cover the structural (value-of-the-firm) and the reduced (intensity-based) approaches to credit risk modeling, applied both to single and to multiple defaults. In particular, the book offers a detailed study of various arbitrage-free models of defaultable term structures with several rating grades.","2002-01","http://books.google.es/books?id=GC5zjZVthFEC&printsec=frontcover&dq=risk&hl=&cd=33&source=gbs_api","3540675930",
"Forensic Assessment of Violence Risk. A Guide for Risk Assessment and Risk Management","risk","[Mary Alice Conroy, Daniel C. Murrie]","[Psychology]","Forensic Assessment of Violence Risk: A Guide for Risk Assessment and Risk Management provides both a summary of research to date and an integrated model for mental health professionals conducting risk assessments, one of the most high-stakes evaluations forensic mental health professionals perform.","2007-11-16","http://books.google.es/books?id=nKG5WaXub8oC&printsec=frontcover&dq=risk&hl=&cd=34&source=gbs_api","0470179732",
"Embracing Risk. The Changing Culture of Insurance and Responsibility","risk","[Tom Baker, Jonathan Simon]","[Law]","For much of the twentieth century, industrialized nations addressed social problems, such as workers' compensation benefits and social welfare programs, in terms of spreading risk. But in recent years a new approach has emerged: using risk both as a way to conceive of and address social problems and as an incentive to reduce individual claims on collective resources. Embracing Risk explores this new approach from a variety of perspectives. The first part of the book focuses on the interplay between risk and insurance in various historical and social contexts. The second part examines how risk is used to govern fields outside the realm of insurance, from extreme sports to policing, mental health institutions, and international law. Offering an original approach to risk, insurance, and responsibility, the provocative and wide-ranging essays in Embracing Risk demonstrate that risk has moved well beyond its origins in the insurance trade to become a central organizing principle of social and cultural life.","2002-02-15","http://books.google.es/books?id=KfiPIwkX_dgC&printsec=frontcover&dq=risk&hl=&cd=35&source=gbs_api","0226035182",
