"title","query","authors","categories","description","published","previewLink","industryId",
"APPROACH FOR COMPARING HEALTH RISKS OF WASTEWATER TREATMENT ALTERNATIVES: A LIMITED COMPARISON OF HEALTH RISKS BETWEEN SLOW RATE LAND TREATMENT AND ACTIVATED SLUDGE TREATMENT AND DISCHARGE.","intitle:risks","[CRITES R W, Ants Uiga]","[Sewage]",,"1979","http://books.google.es/books?id=XWUCSQAACAAJ&dq=intitle:risks&hl=&cd=31&source=gbs_api","OCLC:56279173",
"The Impact of People Risks on Any Organisation, and Potential Strategies to Mitigate Those Risks. A Literature Review","intitle:risks","[Zander Stramrood]","[Employee motivation]",,"2008","http://books.google.es/books?id=xuPWtgAACAAJ&dq=intitle:risks&hl=&cd=32&source=gbs_api","OCLC:251170236",
"Radiation Risks to the Developing Nervous System. International Symposium 'Radiation Risks to the Developing Nervous System', Jointly Org. by ... Neuherberg Near Munich, June 18-20, 1985","intitle:risks","[Heinz Kriegel, International Symposium Radiation Risks to the Developing Nervous System]",,,"1986","http://books.google.es/books?id=-SjxPgAACAAJ&dq=intitle:risks&hl=&cd=33&source=gbs_api","OCLC:258205003",
"Macgillivray on Insurance Law Relating to All Risks Other Than Marine and Including Life, Fire, Accident, Garantee, Burglary, Third Party Risks and Employers' Liability. First supplement (to March, 1949).","intitle:risks","[Evan James Macgillivray]",,,"1949","http://books.google.es/books?id=MoYyAwEACAAJ&dq=intitle:risks&hl=&cd=34&source=gbs_api","OCLC:84031146",
"Benefits and Risks of Vitamins and Minerals","intitle:risks","[Harvard Medical School]","[Minerals in human nutrition]",,"2003-01-01","http://books.google.es/books?id=9ZgYaOustmIC&dq=intitle:risks&hl=&cd=35&source=gbs_api","1933225386",
"Riesgos financieros y economicos/ Financial and Economical Risks. Productos Derivados Y Decisiones Economicas Bajo Incertidumbre","intitle:risks","[Francisco Venegas Martínez]","[Business & Economics]","Este libro proporciona una visión alternativa de las finanzas y la economía que reconoce explícitamente el papel que el riesgo y la incertidumbre desempeñan en las decisiones de portafolio y consumo de los agentes económicos. En un intento de fomentar la cultura de la administración de riesgos, el libro reúne para su estudio diversas herramientas, modelos y técnicas útiles en la identificación, cuantificación, prevención control de los diferentes riesgos a los que los agentes están expuestos.","2008-04-24","http://books.google.es/books?id=jiDFcL8SADsC&printsec=frontcover&dq=intitle:risks&hl=&cd=36&source=gbs_api","9789708300087",
"Managing Banking Risks. Reducing Uncertainty to Improve Bank Performance","intitle:risks","[Eddie Cade]","[Bank management]",,"1999","http://books.google.es/books?id=hpjdMgEACAAJ&dq=intitle:risks&hl=&cd=37&source=gbs_api","157958098X",
"Managing Risks in Projects. Proceedings of the IPMA Symposium on Project Management 1997, Helsinki, Finland, 17-19 September, 1997","intitle:risks","[Kalle Kähkönen, Karlos A. Artto, International Project Management Association]","[Business & Economics]","Managing Risks in Projects presents the latest skills, techniques, knowledge and experience of managing risks in projects from the leading worldwide experts. Many different types of projects are addressed spanning development, software, re-engineering, engineering and construction.","1997","http://books.google.es/books?id=cieCngEACAAJ&dq=intitle:risks&hl=&cd=38&source=gbs_api","0419229906",
"IARC monographs on the evaluation of carcinogenic risks to humans. Vol. 83: Tobacco smoke and involuntary smoking","intitle:risks","[International Agency for Research on Cancer]","[Carcinogens]",,"2004","http://books.google.es/books?id=zREOngEACAAJ&dq=intitle:risks&hl=&cd=39&source=gbs_api","9283212835",
"Manual for the Classification and Prioritization of Risks Due to Major Accidents in Process and Related Industries; Inter-agency Programme on the Assessment and Management of Health and Environmental Risks from Energy and Other Complex Industrial Systems","intitle:risks","[United Nations Environment Programme, United Nations Industrial Development Organization, World Health Organization]","[Energy industries]",,"1996","http://books.google.es/books?id=GxYznQEACAAJ&dq=intitle:risks&hl=&cd=40&source=gbs_api","OCLC:51542079",
"Perceived Risks Versus Actual Risks. Managing Hazards Through Negotiation","intitle:risks","[Kristin S. Shrader-Frechette]",,,"1990","http://books.google.es/books?id=lGbdSAAACAAJ&dq=intitle:risks&hl=&cd=41&source=gbs_api","OCLC:503627590",
"Toxic Risks. Science, Regulation, and Perception","intitle:risks","[Ronald E. Gots]","[Medical]","Policymakers, health professionals, and the general public face growing concerns about environmental matters, particularly those related to ""toxic"" chemicals and their effects on public health. Toxic Risks: Science, Regulation, and Perception explores the political, popular, and regulatory aspects of toxicity and contrasts them with scientifically established facts. The book will be valuable for industrial hygienists, toxicologists, environmental scientists, occupational medicine physicians, family physicians, environmental consultants, government policymakers, and individuals interested in the effects of toxic chemicals on public health.","1993","http://books.google.es/books?id=LHe0ngEACAAJ&dq=intitle:risks&hl=&cd=42&source=gbs_api","0873715101",
"Prevencion de riesgos laborales para gerocultor y auxiliar de ayuda a domicilio / Prevention of occupational risks for geriatric nursing assistant and home care assistant","intitle:risks","[Rafael Ceballos Atienza]","[Medical]",,"2010-09-30","http://books.google.es/books?id=UiotnwEACAAJ&dq=intitle:risks&hl=&cd=43&source=gbs_api","8498910668",
"Managing Business Risks: An Integrated Approach","intitle:risks","[A. Anderson And The Economist Intelligence Unit]",,"This book examines how global companies are responding to the multiplicity of risks they face each day in the market. Risks come from rapid change, new categories of competitors, technological advances, regulatory compliance, fraud and ethical considerations, and a wide range of other causes.","1995","http://books.google.es/books?id=olI7UrVZUD4C&dq=intitle:risks&hl=&cd=44&source=gbs_api","8173712409",
"Organizacion, gestion y prevencion de riesgos laborales en el medio sanitario / Organization, management and prevention of occupational risks in health care","intitle:risks","[Eva Maria Garzas Cejudo, Diana Maria Garcia Gomez-caraballo]","[Health & Fitness]",,"2011-01-14","http://books.google.es/books?id=4-A9YgEACAAJ&dq=intitle:risks&hl=&cd=45&source=gbs_api","8498919592",
"Risks and Managing Risks in Integrated Waste Management PFI Projects in the UK","intitle:risks","[Hiroshi Hasegawa]",,,"2002","http://books.google.es/books?id=YgllHQAACAAJ&dq=intitle:risks&hl=&cd=46&source=gbs_api","OCLC:51104583",
"Managing Business Risks In The Information Age","intitle:risks",,,"This book provides a framework for identifying, sourcing, measuring and monitoring busines risks in general and IT-related risks more specifically. This book shows how companies must manage information technology as a business risk in order to operate effectively. The findings presented here are drawn from 150 survey responses from senior executive in North America, Europe and Asia.","2000","http://books.google.es/books?id=lQHnQ3MuENIC&dq=intitle:risks&hl=&cd=47&source=gbs_api","8173712417",
"Raising Children : Emerging Needs, Modern Risks, and Social Responses. Emerging Needs, Modern Risks, and Social Responses","intitle:risks","[School of Social Welfare University of California Jill Duerr Berrick Professor & Associate Dean, Berkeley, Berkeley Neil Gilbert Chernin Professor of Social Welfare University of California]","[Family & Relationships]",,"2008-01-11","http://books.google.es/books?id=JMA6MwaiBRsC&printsec=frontcover&dq=intitle:risks&hl=&cd=48&source=gbs_api","9780199718733",
"Making Sense of Virtual Risks. A Quasi-Experimental Investigation Into Game-Based Training","intitle:risks","[Casper Harteveld]","[Computers]",,"2012-12-01","http://books.google.es/books?id=lYxEngEACAAJ&dq=intitle:risks&hl=&cd=49&source=gbs_api","1614991707",
"Qualitative Analysis of Cloud Computing Risks and Framework for the Rationalization and Mitigation of Cloud Risks","intitle:risks","[Maria Azua Himmel]","[Computer science]",,"2012","http://books.google.es/books?id=r7hwMwEACAAJ&dq=intitle:risks&hl=&cd=50&source=gbs_api","OCLC:811137899",
"Communication Risks and Best Practices in Global Software Development","intitle:risks","[Ajmal Iqbal, Cigdem Gencel, Shahid Abbas]",,"This book focusses on the identification of communication risks, their causes and effects and the practices to mitigate the risks from both state of the art and state of the practice perspectives. It's like puzzle solving game. According to Casey ""Communication is one the biggest issue that cause due to geographical, temporal and socio-cultural distances."" At the end of the book authors provide set of recommendations based on the best practices that need to be followed by the globally distributed organizations to achieve communicated environment just like co-located settings.","2012-07","http://books.google.es/books?id=jBsVrWbIhYUC&printsec=frontcover&dq=intitle:risks&hl=&cd=51&source=gbs_api","9783659190568",
"Love at All Risks","intitle:risks","[Julian Farrand]",,,"2012-12-01","http://books.google.es/books?id=N9qskQEACAAJ&dq=intitle:risks&hl=&cd=52&source=gbs_api","1780034334",
"Competing Risks. A Practical Perspective","intitle:risks","[Melania Pintilie]","[Medical]","The need to understand, interpret and analyse competing risk data is key to many areas of science, particularly medical research. There is a real need for a book that presents an overview of methodology used in the interpretation and analysis of competing risks, with a focus on practical applications to medical problems, and incorporating modern techniques. This book fills that need by presenting the most up-to-date methodology, in a way that can be readily understood, and applied, by the practitioner.","2006-11-02","http://books.google.es/books?id=ZRh2gl-U6isC&printsec=frontcover&dq=intitle:risks&hl=&cd=53&source=gbs_api","9780470870693",
"Health Risks from Exposure to Low Levels of Ionizing Radiation. BEIR VII ? Phase 2","intitle:risks","[Committee to Assess Health Risks from Exposure to Low Levels of Ionizing Radiation, Board on Radiation Effects Research, Division on Earth and Life Studies, National Research Council]","[Medical]","BEIR VII develops the most up-to-date and comprehensive risk estimates for cancer and other health effects from exposure to low-level ionizing radiation. It is among the first reports of its kind to include detailed estimates for cancer incidence in addition to cancer mortality. In general, BEIR VII supports previously reported risk estimates for cancer and leukemia, but the availability of new and more extensive data have strengthened confidence in these estimates. A comprehensive review of available biological and biophysical data supports a ""linear-no-threshold"" (LNT) risk model?that the risk of cancer proceeds in a linear fashion at lower doses without a threshold and that the smallest dose has the potential to cause a small increase in risk to humans. The report is from the Board on Radiation Research Effects that is now part of the newly formed Nuclear and Radiation Studies Board.","2006-03-21","http://books.google.es/books?id=Uqj4OzBKlHwC&printsec=frontcover&dq=intitle:risks&hl=&cd=54&source=gbs_api","030909156X",
"Taking Risks","intitle:risks","[Sharon Kendrick]","[Fiction]","Could she risk her daughter? It had been six years since Verity Summers had fallen in love with newly qualified doctor Benedict Jackson. Although intense, their relationship hadn't lasted, and Benedict had left to take up a new post, unaware that Verity was to be the mother of their daughter. But now Benedict was returning to Londonto St. Jude's Hospital, where Verity was a theater nurse. Verity was certain she could control the feelings she still harbored for him. But could shedid she want tohide the truth about their daughter?","2011-07-15","http://books.google.es/books?id=B_NY2q-gQRcC&printsec=frontcover&dq=intitle:risks&hl=&cd=55&source=gbs_api","9781459269620",
"Cold Region Hazards and Risks","intitle:risks","[Colin A. Whiteman]","[Science]","This is a unique, timely and engaging text with wide ranging geographical coverage. The text brings together, for the first time, information about a vast array of hazards associated with ice and snow, spanning both well known phenomenon (e.g. avalanches) and the less familiar (e.g. river ice jams and ice storms) using, in many cases, material which is rarely seen outside advanced academic research books and journals. The range of ice-related hazards will be introduced and the significance of the current global warming context discussed. Broad physical models of glacial, periglacial and atmospheric cold environments are presented to provide a scientific context for discussion of the human issues of risk, vulnerability impact and mitigation. Key Features: Wide ranging geographical coverage (the Americas, Asia, Australasia, Antarctic & Europe) Localised hazards (avalanches, life storms, landslides) contrasted to those with wider reaching effects (arctic ice loss, ice sheet retreat and wide spread permafrost decay) Includes the latest developments in the field Each chapter includes hazards overview, summery, conclusions, potential projects exercise and key references Includes a supplementary website with figures from the text and further references Each chapter includes a hazards overview, summary, conclusions, potential projects exercise and key references","2011-03-21","http://books.google.es/books?id=dvdGFvv3lCUC&printsec=frontcover&dq=intitle:risks&hl=&cd=56&source=gbs_api","0470973188",
"Taking Risks. A Jewish Youth in the Soviet Partisans and His Unlikely Life in California","intitle:risks","[Joseph Pell, Fred Rosenbaum]","[Biography & Autobiography]","The night the SS rounded up the Jews of his ghetto, 18-year-old Yosel Epelbaum crawled on his hands and knees to a nearby forest soon to be engulfed by winter. There he joined a band of pro-Soviet partisans who resisted the Nazis and saved hundreds of civilians. After the war, he smuggled contraband from one end of Europe to the other. Then, without money or a formal education and knowing no English, he immigrated to San Francisco. Within a decade, Yosef--""now known as Joe Pell--""was on his way to becoming one of Northern California's leading real estate developers.","2004","http://books.google.es/books?id=e9jjjw44iD8C&printsec=frontcover&dq=intitle:risks&hl=&cd=57&source=gbs_api","1571431160",
"Drug Benefits and Risks. International Textbook of Clinical Pharmacology","intitle:risks","[Christoffel Jos van Boxtel, Budiono Santoso, I. Ralph Edwards]","[Medical]",,"2008-01-01","http://books.google.es/books?id=xQqVbRqA2N8C&printsec=frontcover&dq=intitle:risks&hl=&cd=58&source=gbs_api","9781586038809",
"Acceptable Risks. Politics, Policy, and Risky Technologies","intitle:risks","[C. F. Larry Heimann]","[Political Science]","DIVComplex and risky technologies--technologies such as new drugs for the treatment of AIDS that promise great benefits to our society but carry significant risks--pose many problems for political leaders and the policy makers responsible for overseeing them. Public agencies such as the Food and Drug Administration are told by political superiors not to inhibit important technological advances and may even be charged with promoting such development but must also make sure that no major accidents occur under their watch. Given the large costs associated with catastrophic accidents, the general public and elected officials often demand reliable or failure-free management of these technologies and have little tolerance for the error. /divDIVResearch in this area has lead to a schism between those who argue that it is possible to have reliable management techniques and safely manage complex technologies and others who contend that such control is difficult at best. In this book C. F. Larry Heimann advances an important solution to this problem by developing a general theory of organizational reliability and agency decision making. The book looks at both external and internal influences on reliability in agency decision making. It then tests theoretical propositions developed in a comparative case study of two agencies involved with the handling of risky technologies: NASA and the manned space flight program and the FDA's handling of pharmaceuticals--particularly new AIDS therapies. /divDIVDrawing on concepts from engineering, organizational theory, political science, and decision theory, this book will be of interest to those interested in science and technology policy, bureaucratic management and reform, as well as those interested in health and space policy. /divDIVC. F. Larry Heimann is Assistant Professor of Political Science, Michigan State University. /div","2010-01-01","http://books.google.es/books?id=SfdLzHhymRwC&printsec=frontcover&dq=intitle:risks&hl=&cd=59&source=gbs_api","0472023268",
"Risks at Sea. Amsterdam Insurance and Maritime Europe, 1766-1780","intitle:risks","[Frank C. Spooner]","[Business & Economics]","This book places the marine insurance business of Amsterdam in the wider context of the political economy of Europe during the second half of the eighteenth century. The analysis is based on the simultaneous quotations of premiums for the twenty-two groups of destinations which formed a major part of the commerical matrix of the Netherlands. It considers the operation of the market at two levels. On the one hand, the provision of insurance responded to risk uncertainties in the market: in the 1760s and 1770s, Amsterdam experienced three serious unheavals, in the form of the financial crises of 1763 and 1772-73 and the hostilities leading to American independence and the Fourth Anglo-Dutch War. On the other hand, underwriters accepted risks in situations of structural uncertainty. The book is fully illustrated with graphs and maps and uses a wide range of original documents drawn from archives and libraries in Europe. An appendix provides the basic data of premiums quoted in the price-lists of the market.","2002-07-04","http://books.google.es/books?id=kDEMG3ZrseUC&printsec=frontcover&dq=intitle:risks&hl=&cd=60&source=gbs_api","0521893879",
"Global Health Risks. Mortality and Burden of Disease Attributable to Selected Major Risks","intitle:risks","[World Health Organization]","[Business & Economics]","This publication is a comprehensive assessment of leading risks to global health. It provides detailed global and regional estimates of premature mortality, disability and loss of health attributable to 24 global risk factors.--Publisher's description.","2009","http://books.google.es/books?id=Ycbr2e2WPdcC&printsec=frontcover&dq=intitle:risks&hl=&cd=61&source=gbs_api","9789241563871",
"Taking Risks","intitle:risks","[Kenneth R. Maccrimmon, Donald Wehrung]","[Business & Economics]","Offers tests designed to measure one's willingness to take risks, describes characteristics associated with this quality, and discusses the importance of risk-taking in management and investment situations","1988-09-19","http://books.google.es/books?id=4ainqW0amVUC&printsec=frontcover&dq=intitle:risks&hl=&cd=62&source=gbs_api","9780029195635",
"Main Types of Political Risks Experienced by MNEs","intitle:risks","[Svenja Martina Gnosa]",,"Essay from the year 2011 in the subject Business economics - Marketing, Corporate Communication, CRM, Market Research, Social Media, grade: 1,3, University of St Andrews (School of Management), language: English, abstract: Identify the main types of political risk encountered by multinational corporations and discuss how these risks can be minimized. Introduction The controversy between the Kazak government and the Italian oil company ENI about the exploitation of Kashagans oil fields is only one out of many cases, in which political violence acts or governmental decisions threatened foreign investments of a multinational enterprise (MNE). In April 2006, the Dacion and Jusepin oil fields, operated by ENI and the French company Total, were taken over by the Venezuelan government, because they rejected to change their business operations into joint ventures with the state-owned oil company PDVSA (Ferrari and Rolfini 2008). Stated by Kesternich and Schnitzer (2009) some recent empirical studies identified that for MNEs political risk is one of the most important factors when considering a foreign investment. Foreign investments nowadays seem to be even more risky in terms of pollution that result in natural catastrophes such as caused by BP (Heller 2011), cultural conflicts or political disturbances for which Lybia (Yang 2011) represents a recent example and an increasing social disparity (Bloch, Koepplinger and Wolfrum 2007) [...]","2011","http://books.google.es/books?id=2d5tZ9ZqG4QC&printsec=frontcover&dq=intitle:risks&hl=&cd=63&source=gbs_api","9783640961757",
"Lifelines and Risks. Pathways of Youth in Our Time","intitle:risks","[Robert B. Cairns, Beverley D. Cairns]","[Psychology]","Robert and Beverley Cairns follow the pathways of 695 young people growing up in the 1980s and 1990s (the events and feelings they experience).","1994","http://books.google.es/books?id=aGimIg3nNl4C&printsec=frontcover&dq=intitle:risks&hl=&cd=64&source=gbs_api","0521485703",
"Actuarial Mathematics for Life Contingent Risks","intitle:risks","[Dickson/Hardy/Waters]","[Business & Economics]","A modern perspective on life contingencies that uses the powerful framework of multiple state models to develop and demonstrate a theory that can be adapted to changing products and technologies. Balancing rigor and intuition, and emphasizing applications, this modern text is ideal for university courses and actuarial exam preparation.","2009-09-24","http://books.google.es/books?id=maci14_9kAEC&printsec=frontcover&dq=intitle:risks&hl=&cd=65&source=gbs_api","9781139479455",
"Automobile Insurance: Road Safety, New Drivers, Risks, Insurance Fraud and Regulation. Road Safety, New Drivers, Risks, Insurance Fraud and Regulation","intitle:risks","[Georges Dionne, Claire Laberge-Nadeau]","[Business & Economics]","Motor vehicle accidents are still a leading cause of death, even if the trend has somewhat declined over the past 20 years. Indeed, motor vehicle accidents are a significant cause of death in comparison with air and space transport accidents, homicides and even HIV infections, causes which are more often highlighted in the media. As shown in this book, motor vehicle accidents are particularly damaging to very young drivers. The assessment of driving risks is a common concern for road transportation safety and the automobile insurance industry. In both cases, there is an awareness of the great losses resulting from the deaths, injuries and property damage caused by traffic accidents. Research is essential to counteract this public health threat, to assess the success or failure of countermeasures, and to solve the problems it generates in the insurance industry. This book is for people concerned about road crashes (prevention and compensation) and about the insurance problems they pose - namely private and public institutional authorities, consultants, administrators, practitioners, and researchers interested in sharing the authors' experience in this domain. The book presents original contributions related to motor vehicle insurance and road safety. All papers have been evaluated by external referees. Four subjects are covered: 1) Automobile Insurance Pricing, Risks and Asymmetric Information; 2) Insurance Fraud; 3) Young Drivers: Licensing Policies, Evaluation and Risks; and 4) Road Insurance Regulation.","1999","http://books.google.es/books?id=CoyOr5uvyBwC&printsec=frontcover&dq=intitle:risks&hl=&cd=66&source=gbs_api","079238394X",
"Managing Risks in Supply Chains. How to Build Reliable Collaboration in Logistics","intitle:risks","[Thorsten Blecker, Wolfgang Kersten]","[Business logistics]",,"2006","http://books.google.es/books?id=i_Y4e5wwpjIC&printsec=frontcover&dq=intitle:risks&hl=&cd=67&source=gbs_api","3503097368",
