"title","query","authors","categories","description","published","previewLink","industryId",
"A Guide to Down Syndrome Including Its Physical Features, Risks, Management, and More","intitle:risks","[Charlotte Adele]","[Family & Relationships]","Please note that the content of this book primarily consists of articles available from Wikipedia or other free sources online. Learn more about down syndrome, its genetic origin, research on down syndrome related genes and the types of screening tests for early detection. Project Webster represents a new publishing paradigm, allowing disparate content sources to be curated into cohesive, relevant, and informative books. To date, this content has been curated from Wikipedia articles and images under Creative Commons licensing, although as Project Webster continues to increase in scope and dimension, more licensed and public domain content is being added. We believe books such as this represent a new and exciting lexicon in the sharing of human knowledge.","2012-02-28","http://books.google.es/books?id=GTqkuAAACAAJ&dq=intitle:risks&hl=&cd=194&source=gbs_api","1276152191",
"Analysis of Air Toxics Emissions, Exposures, Cancer Risks and Controllability in Five Urban Areas Controllability Analysis and Results","intitle:risks","[U.S. Environmental Protection Agency]",,"The U.S. Environmental Protection Agency (EPA) was introduced on December 2, 1970 by President Richard Nixon. The agency is charged with protecting human health and the environment, by writing and enforcing regulations based on laws passed by Congress. The EPA's struggle to protect health and the environment is seen through each of its official publications. These publications outline new policies, detail problems with enforcing laws, document the need for new legislation, and describe new tactics to use to solve these issues. This collection of publications ranges from historic documents to reports released in the new millennium, and features works like: Bicycle for a Better Environment, Health Effects of Increasing Sulfur Oxides Emissions Draft, and Women and Environmental Health.","2012-09","http://books.google.es/books?id=XHjhNAEACAAJ&dq=intitle:risks&hl=&cd=195&source=gbs_api","1249430208",
"Risks and Opportunities of the Energy Sector in East Siberia and the Russian Far East. For Better Risk Management and Sustainable Energy Development","intitle:risks","[Sangtu Ko, Kyong Wan Lee]","[Political Science]","This collection provides disciplinary, multi-, and interdisciplinary approaches for risk management and sustainable energy development in East Siberia and the Russian Far East, based on modern, post-, and pre-modern viewpoints. (Series: Politics and Modern History / Politik und Moderne Geschichte - Vol. 16)","2012","http://books.google.es/books?id=cJ_UngEACAAJ&dq=intitle:risks&hl=&cd=196&source=gbs_api","3643902417",
"Water Pollution Risks of Methyl Tertiary Butyl Ether","intitle:risks","[United States Congress Senate Committee]",,"The BiblioGov Project is an effort to expand awareness of the public documents and records of the U.S. Government via print publications. In broadening the public understanding of government and its work, an enlightened democracy can grow and prosper. Ranging from historic Congressional Bills to the most recent Budget of the United States Government, the BiblioGov Project spans a wealth of government information. These works are now made available through an environmentally friendly, print-on-demand basis, using only what is necessary to meet the required demands of an interested public. We invite you to learn of the records of the U.S. Government, heightening the knowledge and debate that can lead from such publications.","2010-12-31","http://books.google.es/books?id=dkJPYgEACAAJ&dq=intitle:risks&hl=&cd=197&source=gbs_api","1240449275",
"Understanding and Managing Interest Rate Risks","intitle:risks","[Ren-Raw Chen]","[Business & Economics]","This book is a systematic summary of modern term structure theories and how interest-rate-contingent claims are priced under such theories. It is the first book on such an attempt. It reviews important term structure models and chooses one model to consistently demonstrate contingent claim pricing. Well-known models are included and their relationships are thoroughly discussed. The book also presents a complete process of model implementation from parameter estimation to hedging. Examples are provided throughout.","1996-01-01","http://books.google.es/books?id=tW4kngEACAAJ&dq=intitle:risks&hl=&cd=198&source=gbs_api","9810227515",
"Air Traffic Control: Immature Software Acquisition Processes Increase FAA System Acquisition Risks","intitle:risks","[BiblioBazaar, United States Government Accountability]",,"The BiblioGov Project is an effort to expand awareness of the public documents and records of the U.S. Government via print publications. In broadening the public understanding of government and its work, an enlightened democracy can grow and prosper. Ranging from historic Congressional Bills to the most recent Budget of the United States Government, the BiblioGov Project spans a wealth of government information. These works are now made available through an environmentally friendly, print-on-demand basis, using only what is necessary to meet the required demands of an interested public. We invite you to learn of the records of the U.S. Government, heightening the knowledge and debate that can lead from such publications.","2011-01-01","http://books.google.es/books?id=vRVNYgEACAAJ&dq=intitle:risks&hl=&cd=199&source=gbs_api","1240670095",
"Risks of Not Breastfeeding - Spanish","intitle:risks","[Diane Spatz, Rachelle Lessen]",,,"2012-05-07","http://books.google.es/books?id=3jQ8nQEACAAJ&dq=intitle:risks&hl=&cd=200&source=gbs_api","0983698120",
"Regulating Chemical Risks. European and Global Challenges","intitle:risks","[Johan Eriksson, Michael Gilek, Christina Rudén]","[Law]","This important contribution to the scientific understanding of chemical risk regulation offers a coherent, comprehensive and updated multidisciplinary analysis, written by leading experts in toxicology, ecotoxicology, risk analysis, media and communication, law, and political science. The text focuses in particular on the new European REACH regime and its nature, causes and consequences. It examines the regime in the context of the interplay between science and policy, the role of the media, human health, and the environment. Other regulatory systems at both domestic and international levels are also studied, including the UNs Globally Harmonised System (GHS) for chemical labelling, as well as developments in the U.S. In addition, readers will find analyses of a number of new and still largely uncharted regulatory systems, along with in-depth assessments of their complexity and transnational nature.","2010","http://books.google.es/books?id=gNX3ngEACAAJ&dq=intitle:risks&hl=&cd=201&source=gbs_api","9048194288",
"Threats and Risks Compendium for Enterprise Risk Management. Threats and Risks to Business Continuity","intitle:risks","[J. & Masp Consulting Group Kuong, J. F. Kuong]","[Business & Economics]",,"2003-04-01","http://books.google.es/books?id=C8asPAAACAAJ&dq=intitle:risks&hl=&cd=202&source=gbs_api","0940706636",
"The Perception and Management of Drug Safety Risks","intitle:risks","[Bruno Horisberger, Rolf Dinkel]","[Medical]","This book represents a collaborative effort by academic experts, members of the pharmaceutical industry, international organizations, and public spokesmen to explore the problems associated with drug risk and drug safety. In an international conference, representatives from 10 countries discussed pharmacology, epidemiology, risk evaluation, regulatory standards, and public communication. Specific topics dealt with include the risk/benefit relationship, biostatistical data interpretation, consumer perception, and proposals for multidisciplinary and international efforts to address challenges in drug safety management.","2011-12-23","http://books.google.es/books?id=yu8ongEACAAJ&dq=intitle:risks&hl=&cd=203&source=gbs_api","3642742742",
"Fire and Explosion Risks. A Handbook Dealing with the Detection, Investigation and Prevention of Dangers Arising from Fires and Explosions of Chemico","intitle:risks","[Ernst Von Schwartz]",,"Unlike some other reproductions of classic texts (1) We have not used OCR(Optical Character Recognition), as this leads to bad quality books with introduced typos. (2) In books where there are images such as portraits, maps, sketches etc We have endeavoured to keep the quality of these images, so they represent accurately the original artefact. Although occasionally there may be certain imperfections with these old texts, we feel they deserve to be made available for future generations to enjoy.","2012-01","http://books.google.es/books?id=D71nngEACAAJ&dq=intitle:risks&hl=&cd=204&source=gbs_api","129001230X",
"Information Technology: Customs Has Made Progress on Automated Commercial Environment System, But It Faces Long-Standing Management Challenges and New Risks","intitle:risks","[United States Government Accountability]",,"The BiblioGov Project is an effort to expand awareness of the public documents and records of the U.S. Government via print publications. In broadening the public understanding of government and its work, an enlightened democracy can grow and prosper. Ranging from historic Congressional Bills to the most recent Budget of the United States Government, the BiblioGov Project spans a wealth of government information. These works are now made available through an environmentally friendly, print-on-demand basis, using only what is necessary to meet the required demands of an interested public. We invite you to learn of the records of the U.S. Government, heightening the knowledge and debate that can lead from such publications.","2011-01-01","http://books.google.es/books?id=h8VGYgEACAAJ&dq=intitle:risks&hl=&cd=205&source=gbs_api","1240703848",
"The Law of Insurance As Applied to Fire, Life, Accident, Guarantee and Other Non-Maritime Risks Volume 2","intitle:risks","[HardPress, May John Wilder 1819-1883]",,"Unlike some other reproductions of classic texts (1) We have not used OCR(Optical Character Recognition), as this leads to bad quality books with introduced typos. (2) In books where there are images such as portraits, maps, sketches etc We have endeavoured to keep the quality of these images, so they represent accurately the original artefact. Although occasionally there may be certain imperfections with these old texts, we feel they deserve to be made available for future generations to enjoy.","2013-01","http://books.google.es/books?id=_BnPnQEACAAJ&dq=intitle:risks&hl=&cd=206&source=gbs_api","1313275603",
"Methodology for Assessing Health Risks Associated with Indirect Exposure to Combustor Emissions, Interim Final","intitle:risks","[U. S. Environmental Protection Agency]",,"The U.S. Environmental Protection Agency (EPA) was introduced on December 2, 1970 by President Richard Nixon. The agency is charged with protecting human health and the environment, by writing and enforcing regulations based on laws passed by Congress. The EPA's struggle to protect health and the environment is seen through each of its official publications. These publications outline new policies, detail problems with enforcing laws, document the need for new legislation, and describe new tactics to use to solve these issues. This collection of publications ranges from historic documents to reports released in the new millennium, and features works like: Bicycle for a Better Environment, Health Effects of Increasing Sulfur Oxides Emissions Draft, and Women and Environmental Health.","2013-07","http://books.google.es/books?id=-SJyngEACAAJ&dq=intitle:risks&hl=&cd=207&source=gbs_api","1289178305",
"Expeditionary Fighting Vehicle Program Faces Cost, Schedule and Performance Risks","intitle:risks","[U.S. Government]",,"Original publisher: Washington, DC: U.S. Govt. Accountability Office, [2010] OCLC Number: (OCoLC)646196879 Subject: Armored vehicles, Military -- United States. Excerpt: ... Enclosure I: Briefing Slides Objective 2: Schedule Risks 14 Page 15 GAO-10-758R Defense Acquisitions","2011-09","http://books.google.es/books?id=OsQKywAACAAJ&dq=intitle:risks&hl=&cd=208&source=gbs_api","1234082128",
"Joint Strike Fighter: Impact of Recent Decisions on Program Risks","intitle:risks","[BiblioBazaar, United States Government Accountability]",,"The BiblioGov Project is an effort to expand awareness of the public documents and records of the U.S. Government via print publications. In broadening the public understanding of government and its work, an enlightened democracy can grow and prosper. Ranging from historic Congressional Bills to the most recent Budget of the United States Government, the BiblioGov Project spans a wealth of government information. These works are now made available through an environmentally friendly, print-on-demand basis, using only what is necessary to meet the required demands of an interested public. We invite you to learn of the records of the U.S. Government, heightening the knowledge and debate that can lead from such publications.","2011-01-01","http://books.google.es/books?id=dXJCYgEACAAJ&dq=intitle:risks&hl=&cd=209&source=gbs_api","1240718284",
"Alternative Mortgage Products: Impact on Defaults Remains Unclear, But Disclosure of Risks to Borrowers Could Be Improved","intitle:risks","[United States Government Accountability]",,"The BiblioGov Project is an effort to expand awareness of the public documents and records of the U.S. Government via print publications. In broadening the public understanding of government and its work, an enlightened democracy can grow and prosper. Ranging from historic Congressional Bills to the most recent Budget of the United States Government, the BiblioGov Project spans a wealth of government information. These works are now made available through an environmentally friendly, print-on-demand basis, using only what is necessary to meet the required demands of an interested public. We invite you to learn of the records of the U.S. Government, heightening the knowledge and debate that can lead from such publications.","2011-01-01","http://books.google.es/books?id=7UWIZwEACAAJ&dq=intitle:risks&hl=&cd=210&source=gbs_api","124069976X",
"Hints on Sea-Risks. Containing Some Practical Suggestions for Diminishing Maritime Losses Both of Life and Property, Addressed to Merchants, Ship-Owne","intitle:risks","[Edward Jennings]",,"This scarce antiquarian book is a facsimile reprint of the original. Due to its age, it may contain imperfections such as marks, notations, marginalia and flawed pages. Because we believe this work is culturally important, we have made it available as part of our commitment for protecting, preserving, and promoting the world's literature in affordable, high quality, modern editions that are true to the original work.","2008-06-01","http://books.google.es/books?id=pJ3_OAAACAAJ&dq=intitle:risks&hl=&cd=211&source=gbs_api","1436870852",
"The Analysis of Actual Versus Perceived Risks","intitle:risks","[V.T. Covello, W.Gary Flamm, Joseph V. Rodricks, Robert G. Tardiff]","[Mathematics]","Proceedings of an international workshop held in Washington, D.C., June 1-3, 1981.","2011-11-04","http://books.google.es/books?id=l2l0ngEACAAJ&dq=intitle:risks&hl=&cd=212&source=gbs_api","1461337623",
"Disaster Vulnerabilities and Risks. Trends, Concepts, Classification and Approaches","intitle:risks","[Prabhas Chandra Sinha]","[Disaster relief]","Disaster Management aims to reduce suffering and economic losses caused by natural and technological disasters. This book provides the reader with an integrated understanding of the various disasters, hazards and crises and their control, mitigation and prevention with reference to possible management solutions.","2006-01-01","http://books.google.es/books?id=ltKUngEACAAJ&dq=intitle:risks&hl=&cd=213&source=gbs_api","8190309862",
"Global Crises and Risks","intitle:risks","[Sally-Ann Totman, Scott Burchill]","[Australia]","Your essential textbook for critical issues in international relations. Global Crises and Risks is written specifically for Deakin University students studying AIR109 'Critical Issues in International Relations'. It follows the subject's structure, and is written by the lecturers: Ken Boutin, Scott Burchill, David Hundt, Costas Laoutides, Michael Leach, Richard Leaver, Amy Nethery, Chengxin Pan, Steven Slaughter, Gary Smith, Craig A. Snyder, Richard Tanter and Sally Totman.","2008","http://books.google.es/books?id=rI7wnQEACAAJ&dq=intitle:risks&hl=&cd=214&source=gbs_api","0195566076",
"Thin Ice and Other Risks. Stories","intitle:risks","[Gary Eller]","[Fiction]","A collection by a winner of the Minnesota Voices Award. In ""Waiting for Extinction,"" the creaking noises of an old house describe its occupants, in ""Thin Ice,"" a skater's effort to maintain balance is compared to holding onto a job.","1994-01-01","http://books.google.es/books?id=2PERPwAACAAJ&dq=intitle:risks&hl=&cd=215&source=gbs_api","0898231558",
"Is It Safe for My Baby? Risks And Recommendations for the Use of Medication, Alcohol, Tobacco And Other Drugs During Pregnancy And Breastfeeding","intitle:risks","[Centre for Addiction and Mental Health]","[Medical]",,"2003","http://books.google.es/books?id=4rALngEACAAJ&dq=intitle:risks&hl=&cd=216&source=gbs_api","0888684460",
"Assessing the Risks of Trace Gases That Can Modify the Stratosphere","intitle:risks","[U.S. Environmental Protection Agency]",,"The U.S. Environmental Protection Agency (EPA) was introduced on December 2, 1970 by President Richard Nixon. The agency is charged with protecting human health and the environment, by writing and enforcing regulations based on laws passed by Congress. The EPA's struggle to protect health and the environment is seen through each of its official publications. These publications outline new policies, detail problems with enforcing laws, document the need for new legislation, and describe new tactics to use to solve these issues. This collection of publications ranges from historic documents to reports released in the new millennium, and features works like: Bicycle for a Better Environment, Health Effects of Increasing Sulfur Oxides Emissions Draft, and Women and Environmental Health.","2012-09","http://books.google.es/books?id=VjHFNAEACAAJ&dq=intitle:risks&hl=&cd=217&source=gbs_api","1249434653",
"Polar-Orbiting Operational Environmental Satellites: Restructuring Is Under Way, But Challenges and Risks Remain","intitle:risks","[BiblioBazaar, United States Government Accountability]",,"The BiblioGov Project is an effort to expand awareness of the public documents and records of the U.S. Government via print publications. In broadening the public understanding of government and its work, an enlightened democracy can grow and prosper. Ranging from historic Congressional Bills to the most recent Budget of the United States Government, the BiblioGov Project spans a wealth of government information. These works are now made available through an environmentally friendly, print-on-demand basis, using only what is necessary to meet the required demands of an interested public. We invite you to learn of the records of the U.S. Government, heightening the knowledge and debate that can lead from such publications.","2011-01-01","http://books.google.es/books?id=fw9uYgEACAAJ&dq=intitle:risks&hl=&cd=218&source=gbs_api","1240713703",
"Social Security Administration: Significant Progress Made in Year 2000 Effort, But Key Risks Remain","intitle:risks","[United States Government Accountability]",,"The BiblioGov Project is an effort to expand awareness of the public documents and records of the U.S. Government via print publications. In broadening the public understanding of government and its work, an enlightened democracy can grow and prosper. Ranging from historic Congressional Bills to the most recent Budget of the United States Government, the BiblioGov Project spans a wealth of government information. These works are now made available through an environmentally friendly, print-on-demand basis, using only what is necessary to meet the required demands of an interested public. We invite you to learn of the records of the U.S. Government, heightening the knowledge and debate that can lead from such publications.","2011-01-01","http://books.google.es/books?id=0HtQYgEACAAJ&dq=intitle:risks&hl=&cd=219&source=gbs_api","1240671156",
"Policy Issues in Insurance Catastrophic Risks and Insurance","intitle:risks","[OECD]","[Compensation (Law)]","These conference proceedings present academic analysis, country reports, and financial/insurance company assessments on how to handle losses caused by large-scale catastrophes including terrorism and atmospheric perils.","2005-07-06","http://books.google.es/books?id=dbTPngEACAAJ&dq=intitle:risks&hl=&cd=220&source=gbs_api","9264009957",
"Electronic Disability Claims Processing: Social Security Administration's Accelerated Strategy Faces Significant Risks","intitle:risks","[BiblioBazaar, United States Government Accountability]",,"The BiblioGov Project is an effort to expand awareness of the public documents and records of the U.S. Government via print publications. In broadening the public understanding of government and its work, an enlightened democracy can grow and prosper. Ranging from historic Congressional Bills to the most recent Budget of the United States Government, the BiblioGov Project spans a wealth of government information. These works are now made available through an environmentally friendly, print-on-demand basis, using only what is necessary to meet the required demands of an interested public. We invite you to learn of the records of the U.S. Government, heightening the knowledge and debate that can lead from such publications.","2011-01-01","http://books.google.es/books?id=z6VBYgEACAAJ&dq=intitle:risks&hl=&cd=221&source=gbs_api","1240686218",
"Health Risks from Low-Level Environmental Exposure to Radionuclides. Federal Guidance Report Number 13, Part 1, Interim Version","intitle:risks","[U.S. Environmental Protection Agency]","[Political Science]","The U.S. Environmental Protection Agency (EPA) was introduced on December 2, 1970 by President Richard Nixon. The agency is charged with protecting human health and the environment, by writing and enforcing regulations based on laws passed by Congress. The EPA's struggle to protect health and the environment is seen through each of its official publications. These publications outline new policies, detail problems with enforcing laws, document the need for new legislation, and describe new tactics to use to solve these issues. This collection of publications ranges from historic documents to reports released in the new millennium, and features works like: Bicycle for a Better Environment, Health Effects of Increasing Sulfur Oxides Emissions Draft, and Women and Environmental Health.","2013-03","http://books.google.es/books?id=5httmwEACAAJ&dq=intitle:risks&hl=&cd=222&source=gbs_api","1288960298",
"Pension Benefit Guaranty Corporation: Single-Employer Pension Insurance Program Faces Significant Long-Term Risks","intitle:risks","[United States Government Accountability]",,"The BiblioGov Project is an effort to expand awareness of the public documents and records of the U.S. Government via print publications. In broadening the public understanding of government and its work, an enlightened democracy can grow and prosper. Ranging from historic Congressional Bills to the most recent Budget of the United States Government, the BiblioGov Project spans a wealth of government information. These works are now made available through an environmentally friendly, print-on-demand basis, using only what is necessary to meet the required demands of an interested public. We invite you to learn of the records of the U.S. Government, heightening the knowledge and debate that can lead from such publications.","2011-01-01","http://books.google.es/books?id=pURPYgEACAAJ&dq=intitle:risks&hl=&cd=223&source=gbs_api","1240691963",
"Displacement Risks in Africa","intitle:risks","[Itaru Ohta, Yntiso D. Gebre]","[Political Science]","As the plight of refugees around the world looms large as one of the central problems facing the international political community at the beginning of the 21st century, the situations facing displaced persons in Africa are both acute manifestations of this global trend, and unique in their particularities. As the powerful nations of the world are mobilized to tackle domestic conflicts and their ensuing refugee problems in the Balkans, the Middle East, Southeast Asia and elsewhere, African societies have typically been abandoned by the international community to resolving their own conflicts through their own means. The authors of this volume examine both causes and effects of displacement in terms of both local and global politics, environmental risks, socio-economic costs, and policy and identity issues. Combined, these papers provide a powerful if not comprehensive overview of the variety and complexity of circumstances concerning displaced persons.","2005","http://books.google.es/books?id=UHoEfZpLNtsC&dq=intitle:risks&hl=&cd=224&source=gbs_api","1920901094",
"Prevencin de riesgos laborales para el auxiliar de farmacia / Prevention of occupational risks for the pharmacy technician","intitle:risks","[Rafael Ceballos Atienza]","[Business & Economics]",,"2010-11-30","http://books.google.es/books?id=f7VXngEACAAJ&dq=intitle:risks&hl=&cd=226&source=gbs_api","849891065X",
