"title","query","authors","categories","description","published","previewLink","industryId",
"An Analysis of Transfer Risk in Comparison to Sovereign Risk","intitle:risk","[Philipp Hauger]","[Business & Economics]","Transfer risk is the risk that a non-sovereign entity, which is able and willing to service its foreign currency obligations, cannot obtain the required currency or cannot transfer this money to the receiver abroad. This transfer inability is caused by the imposition of restrictions on convertibility or capital transfers by the government. Transfer risk applies to all types of international investments, especially in emerging market countries. Due to this, it is more important than ever in these days of globalization. The New Basel Capital Accords require the consideration of transfer risk, too. The author Philipp Hauger describes the different types of risk occurring in international borrowings and investments. The political and corporate determinants of transfer risk are examined. The book illustrates the reasons why monetary unions reduce the risk of a transfer event, even though they have no influence on the sovereign risk. In addition, the author details how transfer risk is assessed by international professionals and describes two interesting approaches to estimate transfer risk in a quantitative way. This book is intended for professionals and students who are interested in the risks of international investments and for everybody working in international business, who has to differentiate between sovereign risk and the risk of a corporate default.","2006-10-21","http://books.google.es/books?id=l0NPQM46vFIC&printsec=frontcover&dq=intitle:risk&hl=&cd=65&source=gbs_api","9783638559454",
"The Essentials of Risk Management, Chapter 1 - Risk Management--A Helicopter Views","intitle:risk","[Michel Crouhy, Dan Galai, Robert Mark]","[Business & Economics]","Here is a chapter from The Essentials of Risk Management, a practical, non-ivory tower approach that is necessary to effectively implement a superior risk management program. Written by three of the leading figures with extensive practical and theoretical experience in the global risk management and corporate governance arena, this straightforward guidebook features such topics as governance, compliance and risk management; how to implement integrated risk management; measuring, managing and hedging market, and more.","2005-12-14","http://books.google.es/books?id=-y_jVSmKdygC&printsec=frontcover&dq=intitle:risk&hl=&cd=66&source=gbs_api","9780071731317",
"Risk Assessment and Risk Management in the Pharmaceutical Industry. Clear and Simple","intitle:risk","[James L. Vesper]","[Business & Economics]",,"2006-03-01","http://books.google.es/books?id=AyRPAAAAMAAJ&dq=intitle:risk&hl=&cd=67&source=gbs_api","UOM:39015064768164",
"Risk and Protective Factors in the Development of Psychopathology","intitle:risk","[Jon Rolf, Norman Garmezy]","[Psychology]","Chapters by distinguished investigators in clinical psychology, psychiatry, and child development, many of whose work led to the new developmental model of psychopathology, provide a unique review of current research on vulnerability and resistance to disorder.","1990-08-31","http://books.google.es/books?id=-CrJngEACAAJ&dq=intitle:risk&hl=&cd=68&source=gbs_api","0521350999",
"Uncertainty in risk assessment, risk management, and decision making","intitle:risk","[Vincent T. Covello, Society for Risk Analysis]","[Business & Economics]",,"1987","http://books.google.es/books?id=aPzsAAAAMAAJ&dq=intitle:risk&hl=&cd=69&source=gbs_api","UOM:39015012290600",
"Uncertainty, Risk Aversion and Risk Management for Agricultural Producers","intitle:risk","[Giancarlo Moschini, David A. Hennessy, Iowa State University. Dept. of Economics]","[Farm management]",,"1999","http://books.google.es/books?id=8i9HGwAACAAJ&dq=intitle:risk&hl=&cd=70&source=gbs_api","OCLC:45059536",
"The Risk Free Rate and the Relation Volatility-market Risk Premium","intitle:risk","[Alicia de las Heras, Juan M. Nave Pineda, Gregorio Serna Calvo]",,,"2001","http://books.google.es/books?id=zrMacgAACAAJ&dq=intitle:risk&hl=&cd=71&source=gbs_api","OCLC:642144706",
"Risk Assessment and Risk Management","intitle:risk",,"[Hazardous substances]",,"1985","http://books.google.es/books?id=UfKsHAAACAAJ&dq=intitle:risk&hl=&cd=72&source=gbs_api","OCLC:12869419",
"RISK VS. RISK","intitle:risk","[John D. GRAHAM, Jonathan Baert Wiener]","[Medical]","We see the stories in the newspaper nearly every day: a drug hailed as a breakthrough treatment turns out to cause harmful side effects; controls implemented to reduce air pollution are shown to generate hazardous solid waste; bans on dangerous chemicals result in the introduction of even more risky substitutes. Could our efforts to protect our health and the environment actually be making things worse? This suspicion has long troubled both advocates and critics of risk-reduction efforts, but the problem has never received focused scrutiny. In Risk vs. Risk, John D. Graham, Jonathan Baert Wiener, and their colleagues at the Harvard Center for Risk Analysis marshal an impressive set of case studies which demonstrate that all too often our nation's campaign to reduce risks to our health and the environment is at war with itself, steadily creating new risks. At the heart of this volume is a set of nine case studies illustrating the complexities of risk tradeoffs, ranging from personal medical choices to control of toxic substances to prevention of global crises. In each case, authors with specific expertise in the field dissect the multidimensional risk consequences of choices facing decision makers. Some of these cases reveal utter folly in risk-reduction efforts; others show decision makers recognizing and dealing with risk tradeoffs.","1995","http://books.google.es/books?id=SdjmWw5baDoC&printsec=frontcover&dq=intitle:risk&hl=&cd=73&source=gbs_api","0674773047",
"A Review of the Capability of the Environmental Risk Management Authority (ERMA) Relating the the Risk Management of New Organisms","intitle:risk","[New Zealand. Environmental Risk Management Authority, New Zealand. Ministry for the Environment]","[Environmental risk assessment]",,"2003","http://books.google.es/books?id=HcZ9MQAACAAJ&dq=intitle:risk&hl=&cd=74&source=gbs_api","OCLC:155857616",
"Risk. A Country-by-country Guide","intitle:risk",,"[Country risk]",,,"http://books.google.es/books?id=bu-3AAAAIAAJ&dq=intitle:risk&hl=&cd=75&source=gbs_api","UCSD:31822031076813",
"Symposium of Risk Assessment of Urban Air: Emissions, Exposure, Risk Identification, and Risk Quantitation. May 31 - June 2, 1992, Stockholm, Sweden","intitle:risk","[National Institute of Environmental Health Sciences, Symposium of Risk Assessment of Urban Air: Emissions, Exposure, Risk Identification, and Risk Quantitation. 1992, Stockholm, Centrum för Nutrition och Toxikologi. Huddinge]",,,"1994","http://books.google.es/books?id=PqxYnwEACAAJ&dq=intitle:risk&hl=&cd=76&source=gbs_api","OCLC:312284570",
"Climate Risk and the Weather Market. Financial Risk Management with Weather Hedges","intitle:risk","[Robert S. Dischel]","[Assurance contre les catastrophes]","Provides a highly accessible and complete coverage of weather risk management as seen from the perspective of practitioners, consultants and academics.","2002","http://books.google.es/books?id=5StqQgAACAAJ&dq=intitle:risk&hl=&cd=77&source=gbs_api","1899332529",
"Measuring Market Risk with Value at Risk","intitle:risk","[Pietro Penza, Vipul K. Bansal]","[Business & Economics]","""This book, Measuring Market Risk with Value at Risk by Vipul Bansal and Pietro Penza, has three advantages over earlier works on the subject. First, it takes a decidedly global approach-an essential ingredient for any comprehensive work on market risk. Second, it ties the scientifically grounded, yet intuitively appealing, VaR measure to earlier, more idiosyncratic measures of market risk that are used in specific market environs (e.g., duration in fixed income). Finally, it encompasses all of the accepted approaches to calculating a VaR measure and presents them in a clearly explained fashion with supporting illustrations and completely worked-out examples."" -from the Foreword by John F. Marshall, PhD, Principal, Marshall, Tucker & Associates, LLC ""Measuring Market Risk with Value at Risk offers a much-needed intellectual bridge, a translation from the esoteric realm of mathematical finance to the domain of financial managers who seek guidance in applying developments from this important field of research as well as that of MBA-level graduate instruction. I believe the authors have done a commendable job of providing a carefully crafted, highly readable, and most useful work, and intend to recommend it to all those involved in business risk management applications."" -Anthony F. Herbst, PhD, Professor of Finance and C.R. and D.S. Carter Chair, The University of Texas, El Paso and Founding editor of The Journal of Financial Engineering (1991-1998) ""Finally there's a book that strikes a balance between rigor and application in the area of risk management in the banking industry. This innovative book is a MUST for both novices and professionals alike."" -Robert P. Yuyuenyongwatana, PhD, Associate Professor of Finance, Cameron University ""Measuring Market Risk with Value at Risk is one of the most complete discussions of this emerging topic in finance that I have seen. The authors develop a logical and rigorous framework for using VaR models, providing both historical references and analytical applications."" -Kevin Wynne, PhD, Associate Professor of Finance, Lubin School of Business, Pace University","2001","http://books.google.es/books?id=ZwH44DRQXLoC&printsec=frontcover&dq=intitle:risk&hl=&cd=78&source=gbs_api","0471393134",
"Introduction risk perception and risk communication","intitle:risk","[Peter M. Wiedemann]",,,"1993","http://books.google.es/books?id=adGkYgEACAAJ&dq=intitle:risk&hl=&cd=79&source=gbs_api","OCLC:313420275",
