"title","query","authors","categories","description","published","previewLink","industryId",
"Food Safety Assurance and Veterinary Public Health: Risk management strategies : monitoring and surveillance","intitle:risk","[Frans J. M. Smulders, John Daniel Collins]","[Technology & Engineering]","For the veterinarian, monitoring and surveillance represent the best means of ensuring sustainable animal production at a time when consumer demands reflect awareness that many of the hazards associated with food animal production can be minimised or avoided through proper management at the primary production level. Preventive medicine and quality and safety assurance programmes are primarily based on knowledge of the existing strengths and weaknesses of the clients' enterprise and their ability to enact effective intervention measures. Accordingly, the food animal veterinarian relies upon effective monitoring of current performance and herd health status both for the purpose of maximising efficiency of production and providing an assurance that the primary food product meets required health standards in terms of freedom from those agents of concern that have their origin on the farm. These agents include foodborne parasites, pathogenic bacteria, some of which display a resistance to antimicrobial agents, contaminants of environmental origin, as well as chemical and pharmaceutical residues. The more successful these hazards are addressed at the farm, the better the quality and safety of the final product and their marketing possibilities will be. Communication between the primary producer and the food processing industry that facilitates real-time exchange of information on these issues is essential for the practice of preventive medicine at the herd and flock level. Integrated food chain quality and safety control programmes, when linked to such monitoring and surveillance principles in regard to both human and animal health, represent the means of achieving sustainable food animal production on a global scale, in line with the conclusions of WTO and EU. Volume 3 of the ""Food Safety Assurance and Veterinary Public Health"" series addresses this collaborative approach. Leading international experts from academia, industry and governmental institutions have been identified to deal with the various aspects of this collaborative approach in monitoring and surveillance.","2005","http://books.google.es/books?id=pYqTqQJHi8sC&printsec=frontcover&dq=intitle:risk&hl=&cd=283&source=gbs_api","9789076998077",
"Bodybuilding, Drugs and Risk","intitle:risk","[Lee F. Monaghan]","[Medical]","Current popular interest in bodies, fitness, sport and active lifestyles, has made bodybuilding more visible and acceptable within mainstream society than ever before. However, the association between bodybuilding, drugs and risk has contributed to a negative image of an activity which many people find puzzling. Using data obtained from participant observation and interviews, this book explores bodybuilding subculture from the perspective of the bodybuilder. It looks at: * How bodybuilders try to maintain competent social identities * How they manage the risks of using steroids and other physique-enhancing drugs * How they understand the alleged steroid-violence link * How they 'see' the muscular body. Through systematic exploration it becomes apparent that previous attempts to explain bodybuilding in terms of 'masculinity-in-crisis' or gender insecurity are open to question. Different and valuable insights into what sustains and legitimizes potentially dangerous drug-taking activities are provided by this detailed picture of a huge underground subculture.","2001-01","http://books.google.es/books?id=Zc1lA7BUlkEC&printsec=frontcover&dq=intitle:risk&hl=&cd=284&source=gbs_api","041522683X",
"Advanced Derivatives Pricing and Risk Management. Theory, Tools and Hands-on Programming Application","intitle:risk","[Claudio Albanese, Giuseppe Campolieti]","[Business & Economics]","Written by leading academics and practitioners in the field of financial mathematics, the purpose of this book is to provide a unique combination of some of the most important and relevant theoretical and practical tools from which any advanced undergraduate and graduate student, professional quant and researcher will benefit. This book stands out from all other existing books in quantitative finance from the sheer impressive range of ready-to-use software and accessible theoretical tools that are provided as a complete package. By proceeding from simple to complex, the authors cover core topics in derivative pricing and risk management in a style that is engaging, accessible and self-instructional. The book contains a wide spectrum of problems, worked-out solutions, detailed methodologies and applied mathematical techniques for which anyone planning to make a serious career in quantitative finance must master. In fact, core portions of the book's material originated and evolved after years of classroom lectures and computer laboratory courses taught in a world-renowned professional Master's program in mathematical finance. As a bonus to the reader, the book also gives a detailed exposition on new cutting-edge theoretical techniques with many results in pricing theory that are published here for the first time. *Includes easy-to-implement VB/VBA numerical software libraries *Proceeds from simple to complex in approaching pricing and risk management problems *Provides analytical methods to derive cutting-edge pricing formulas for equity derivatives","2006","http://books.google.es/books?id=g3Q9ql5tKWYC&printsec=frontcover&dq=intitle:risk&hl=&cd=285&source=gbs_api","9780120476824",
"Pesticide Risk in Groundwater","intitle:risk","[Enzo Funari, Marco Vighi]","[Technology & Engineering]","Pesticide pollution of groundwater results from agricultural practices, the properties of the substance and its behavior in the soil environment, and the characteristics of aquifers and their vulnerability. Pesticide Risk in Groundwater provides an overview of the main issues concerning pesticide pollution of groundwater worldwide. The book is divided into five sections. Section I reviews experimental data of groundwater monitoring to indicate the extent of the problem on a global basis. Based on this evaluation, herbicides are examined in depth. Section II describes predictive approaches to estimate the distribution and fate of pesticides, and includes a chapter devoted to hydrogeological aspects affecting the vulnerability of aquifers. The third section evaluates pesticides in relation to their toxicology. It critically examines the criteria and procedures by the World Health Organization (WHO) and the U.S. Environmental Protection Agency (EPA) to define quality objectives, and compares the monitoring data on pesticides in groundwater with their quality objectives. Section IV evaluates various strategies to control and prevent groundwater pollution problems. Different water treatment options are described from a technical and economic point of view. The main preventative actions include the chemical approach, the agronomic approach, and the land use approach. The final section reviews the state of the art of drinking water regulations in the EEC, the United States, and other OECD countries. The author describes the economic implications of groundwater pollution and its control and exemplifies with a real case study.","1995-05-04","http://books.google.es/books?id=fiSzFPJXXO0C&printsec=frontcover&dq=intitle:risk&hl=&cd=286&source=gbs_api","0873714393",
"Modelling Operational Risk Using Bayesian Inference","intitle:risk","[Pavel V. Shevchenko]","[Business & Economics]","This book presents a Bayesian framework for operational risk that can be used by banks to resolve quantitative challenges with implementation of Basel II advanced measurement approach. Numerous examples help risk practitioners quantify operational risks.","2011-01-19","http://books.google.es/books?id=ZAtW4gBEWSoC&printsec=frontcover&dq=intitle:risk&hl=&cd=287&source=gbs_api","3642159230",
"Risk and Reward. The Science of Casino Blackjack","intitle:risk","[N. Richard Werthamer]","[Games]","Blackjack is among the most popular of the casino table games, one where astute choices of playing strategy can create an advantage for the player. This title analyzes the game, showing its optimal strategies as well as its financial performance, in terms of both expected cash flow and associated risk.","2009-07-07","http://books.google.es/books?id=a4CbdeLvqOEC&printsec=frontcover&dq=intitle:risk&hl=&cd=288&source=gbs_api","1441902538",
"Handbook of Integrated Risk Management in Global Supply Chains","intitle:risk","[Panos Kouvelis, Lingxiu Dong, Onur Boyabatli, Rong Li]","[Business & Economics]","A comprehensive, one-stop reference for cutting-edge research in integrated risk management, modern applications, and best practices In the field of business, the ever-growing dependency on global supply chains has created new challenges that traditional risk management must be equipped to handle. Handbook of Integrated Risk Management in Global Supply Chains uses a multi-disciplinary approach to present an effective way to manage complex, diverse, and interconnected global supply chain risks. Contributions from leading academics and researchers provide an action-based framework that captures real issues, implementation challenges, and concepts emerging from industry studies.The handbook is divided into five parts: Foundations and Overview introduces risk management and discusses the impact of supply chain disruptions on corporate performance Integrated Risk Management: Operations and Finance Interface explores the joint use of operational and financial hedging of commodity price uncertainties Supply Chain Finance discusses financing alternatives and the role of financial services in procurement contracts; inventory management and capital structure; and bank financing of inventories Operational Risk Management Strategies outlines supply risks and challenges in decentralized supply chains, such as competition and misalignment of incentives between buyers and suppliers Industrial Applications presents examples and case studies that showcase the discussed methodologies Each topic's presentation includes an introduction, key theories, formulas, and applications. Discussions conclude with a summary of the main concepts, a real-world example, and professional insights into common challenges and best practices. Handbook of Integrated Risk Management in Global Supply Chains is an essential reference for academics and practitioners in the areas of supply chain management, global logistics, management science, and industrial engineering who gather, analyze, and draw results from data. The handbook is also a suitable supplement for operations research, risk management, and financial engineering courses at the upper-undergraduate and graduate levels.","2011-10-26","http://books.google.es/books?id=fi5LI-L-FN0C&printsec=frontcover&dq=intitle:risk&hl=&cd=289&source=gbs_api","9781118115794",
"Risk Analysis and Society. An Interdisciplinary Characterization of the Field","intitle:risk","[Timothy McDaniels, Mitchell Small]","[Health & Fitness]","An interdisciplinary and international characterization of the state of the science of risk analysis, first published in 2004.","2004","http://books.google.es/books?id=IqeVYw9MFeQC&printsec=frontcover&dq=intitle:risk&hl=&cd=290&source=gbs_api","0521532639",
"Acceptable Risk","intitle:risk","[Robin Cook]","[Fiction]","Robin Cook has always been on the cutting edge of the latest medical controversies. In Acceptable Risk, he confronts one of the most provocative issues of our time: personality-altering drugs and the complex moral questions they raise. Neuroscientist Edward Armstrong has managed to isolate a psychotropic drug with a strange and dark history--one that may account for the public hysteria during the Salem witch trials. In a brilliant designer-drug transformation, it is developed into an antidepressant with truly startling therapeutic capabilities. But who can be sure the drug is safe for consumers? Who defines the boundaries of ""normal"" human behavior? And if the drug's side effects are proven to be dangerous--even terrifying--how far will the medical community go to alter their standards of...Acceptable Risk.","1996-02-01","http://books.google.es/books?id=yWdsWSJAE-MC&printsec=frontcover&dq=intitle:risk&hl=&cd=291&source=gbs_api","1101203552",
"New Perspectives on Adolescent Risk Behavior","intitle:risk","[Richard Jessor]","[Medical]","New ideas on risk behavior among adolescents.","1998-09-13","http://books.google.es/books?id=M4cV9nNWliEC&printsec=frontcover&dq=intitle:risk&hl=&cd=292&source=gbs_api","0521586070",
"LNG Risk Based Safety. Modeling and Consequence Analysis","intitle:risk","[John L. Woodward, Robin Pitbaldo]","[Technology & Engineering]","Liquefied Natural Gas (LNG) is the only viable way to extract and transport natural gas from areas not serviceable by a pipeline, but it also poses safety risks. This book examines the safety concerns regarding LNG, and examines the debate between its advocates and its opponents. The text considers risks on the extraction, transportation, and maintenance of LNG; includes discussion of case studies and LNG-related accidents over the past half-century; and summerizes the findings of the Governmental Accountability Office's (GAO) survey of nineteen LNG experts from across North America and Europe.","2010-03-25","http://books.google.es/books?id=XsOt-ANP0VEC&printsec=frontcover&dq=intitle:risk&hl=&cd=293&source=gbs_api","047059022X",
"The Exquisite Risk. Daring to Live an Authentic Life","intitle:risk","[Mark Nepo]","[Self-Help]","In these fast-paced times, the exquisite risk facing each of us every day is to slow down and still our own house so that we may experience life rather than simply manage it. In The Exquisite Risk, poet and teacher Mark Nepo encourages readers to become quiet enough and open enough to listen to what truly mattersour own hearts, our loved ones, the wonders of naturein order to live a life with nothing held back. In rich, lyrical prose, Nepo shares his own spiritual path, including a battle with illness that helped him understand how only by daring to embrace all that life has to offer can we come to a deeper appreciation of its meaning and beauty. In the spirit of works by Deepak Chopra and Ram Dass, The Exquisite Risk unfolds in chapters like The Struggle to Be Real, There Are Teachers Everywhere, The Rhythm of Kindness, and The Gift of Surprise, offering fresh perspective on the art of being alive and providing essential insight into how we can minimize what stands between us and our experience of life. From the Hardcover edition.","2007-12-18","http://books.google.es/books?id=6SWCIyJz3CIC&printsec=frontcover&dq=intitle:risk&hl=&cd=294&source=gbs_api","0307422003",
"Handbook of Violence Risk Assessment and Treatment. New Approaches for Mental Health Professionals","intitle:risk","[Joel T. Andrade Ph.D., LICSW]","[Social Science]","""This book describes violence risk assessment in both juveniles and adults, incorporating dynamic and static factors, along with treatment alternatives ..Research and practice are combined quite nicely, along with assessment and treatment. There is something for everyone here."" Score: 91, 4 stars --Doody's ""Forensic clinicians will find this book to be a valuable reference book as well as a very useful clinical treatment guide relevant to violent offenders."" --Jeffrey L. Metzner, MD Mental health practitioners are confronted with the difficult task of assessing the risk that offenders pose to the general public. This comprehensive volume provides practitioners with the knowledge and insight necessary to conduct violence risk assessments, and to synthesize clinical and research data into comprehensive reports and oral testimony. Violence risk assessment requires a well-formulated and comprehensive risk management plan. Andrade and the authors present that plan, and demonstrate how it can be clearly implemented in practice. With numerous clinical case studies, this book illustrates the process of conducting violence risk assessments, outlines the tools used in these evaluations, and explains how information is translated into an overall assessment and guide for future risk management. Key Features: Investigates the etiology of violent behavior, and provides a review and analysis of recent literature Discusses both adult and youth violence, providing insight into the developmental course of aggressive behavior throughout the lifespan Contains chapters on special populations, including female offenders, intimate partners, psychopathic and mentally ill offenders, and sexually abusive youth Useful to practitioners from various fields including social work, psychology, and psychiatry, as well as students in these disciplines Ultimately, this book provides practitioners with an understanding of risk assessment, treatment, and risk management, serving as an authoritative guide to applying empirical findings to mental health practice.","2009-03-23","http://books.google.es/books?id=_zxz3XqE8MkC&printsec=frontcover&dq=intitle:risk&hl=&cd=295&source=gbs_api","9780826199041",
"Handbook of Cancer Risk Assessment and Prevention","intitle:risk","[Graham A. Colditz, Cynthia J. Stein]","[Medical]","Written for health care providers at all levels, the Handbook of Cancer Risk Assessment and Prevention covers in depth fourteen of the most common cancers in the U.S. - providing for each a scientific summary of risk factors, a risk assessment tool for patients, and helpful hints to promote risk-reducing lifestyle changes. Additional chapters focus specifically on five key lifestyle behaviors that lower not only the risk of cancer but also the risk of other chronic diseases. Throughout the Handbook emphasizes the importance of effectively communicating risk to patients. A chapter is devoted solely to this topic, and risk information about each cancer is presented in a variety of formats. Finally, the risk assessment tools - adaptations from the popular website Your Cancer Risk - offer patients the option to estimate their individual cancer risk and receive practical, personal tips for lowering that risk. The Handbook of Cancer Risk Assessment and Prevention is an essential source for reliable, up-to-date information on cancer prevention. It delivers positive health messages and offers practical advice that health care providers can use to help patients implement strategies to prevent cancer and other chronic diseases.","2004","http://books.google.es/books?id=hoKZ7A8nwaIC&printsec=frontcover&dq=intitle:risk&hl=&cd=296&source=gbs_api","0763718831",
"From ""Backwardness"" to ""At-Risk"". Childhood Learning Difficulties and the Contradictions of School Reform","intitle:risk","[Barry M. Franklin]","[Education]","This book examines the joint effort of twentieth-century public school administrators and private philanthropy to initiate reforms to provide for children with learning difficulties. The author explores the development of these reforms from the establishment of special classes for backward children at the beginning of the century to the creation of programs for learning disabled children. He considers what this history tells us about current efforts to provide for at-risk students. He looks at both the way school administrators conceptualized childhood learning difficulties and the institutional arrangements which they introduced to accommodate these students, and pays particular attention to the preference of school administrators throughout this century for accommodating low achieving children in segregated classes and programs.","1994","http://books.google.es/books?id=EVQtNzD0VHcC&printsec=frontcover&dq=intitle:risk&hl=&cd=297&source=gbs_api","0791419088",
"Financial Risk Modelling and Portfolio Optimization with R","intitle:risk","[Bernhard Pfaff]","[Mathematics]","Introduces the latest techniques advocated for measuring financial market risk and portfolio optimization, and provides a plethora of R code examples that enable the reader to replicate the results featured throughout the book. Financial Risk Modelling and Portfolio Optimization with R: Demonstrates techniques in modelling financial risks and applying portfolio optimization techniques as well as recent advances in the field. Introduces stylized facts, loss function and risk measures, conditional and unconditional modelling of risk; extreme value theory, generalized hyperbolic distribution, volatility modelling and concepts for capturing dependencies. Explores portfolio risk concepts and optimization with risk constraints. Enables the reader to replicate the results in the book using R code. Is accompanied by a supporting website featuring examples and case studies in R. Graduate and postgraduate students in finance, economics, risk management as well as practitioners in finance and portfolio optimization will find this book beneficial. It also serves well as an accompanying text in computer-lab classes and is therefore suitable for self-study.","2012-10-17","http://books.google.es/books?id=Nyz0L9wVVXwC&printsec=frontcover&dq=intitle:risk&hl=&cd=298&source=gbs_api","9781118477137",
"The Handbook of Credit Risk Management. Originating, Assessing, and Managing Credit Exposures","intitle:risk","[Sylvain Bouteille, Diane Coogan-Pushner]","[Business & Economics]","A comprehensive guide to credit risk management The Handbook of Credit Risk Management presents a comprehensive overview of the practice of credit risk management for a large institution. It is a guide for professionals and students wanting a deeper understanding of how to manage credit exposures. The Handbook provides a detailed roadmap for managing beyond the financial analysis of individual transactions and counterparties. Written in a straightforward and accessible style, the authors outline how to manage a portfolio of credit exposures--from origination and assessment of credit fundamentals to hedging and pricing. The Handbook is relevant for corporations, pension funds, endowments, asset managers, banks and insurance companies alike. Covers the four essential aspects of credit risk management: Origination, Credit Risk Assessment, Portfolio Management and Risk Transfer. Provides ample references to and examples of credit market services as a resource for those readers having credit risk responsibilities. Designed for busy professionals as well as finance, risk management and MBA students. As financial transactions grow more complex, proactive management of credit portfolios is no longer optional for an institution, but a matter of survival.","2012-12-07","http://books.google.es/books?id=F_AYj_t83xYC&printsec=frontcover&dq=intitle:risk&hl=&cd=299&source=gbs_api","9781118419762",
"Brand Risk. Adding Risk Literacy to Brand Management","intitle:risk","[David Abrahams]","[Business & Economics]","Brand risk is often narrowly defined as risk to reputation. Yet risk is evident in every aspect of brand performance and marketing operations. Responsible risk taking is central to effective brand management. Risk literacy is the marketer's third necessary competence, alongside strategic insight and financial understanding. In a practical and accessible book for those who hold responsibilities in marketing or risk management, David Abrahams brings together relevant risk thinking and a range of accepted techniques for the evaluation of brand exposures - whether in response to the ambitions of a key business project, new market conditions or in answer to shareholder concern. A balanced review of the subject is enriched by reference to topics of current interest, supported by illustrative examples throughout. Presenting the essentials of brand management and risk management side-by-side, the book suggests approaches to brand risk assessment at alternative levels of complexity, from the intuitive to the data-driven.","2008-01-01","http://books.google.es/books?id=CKmbai2K-MMC&printsec=frontcover&dq=intitle:risk&hl=&cd=300&source=gbs_api","0566087243",
"Social Theories of Risk and Uncertainty. An Introduction","intitle:risk","[Jens O. Zinn]","[Social Science]","Written by leading experts in the field, Social Theories of Risk and Uncertainty is an introduction to mainstream theorizing on risk and uncertainty in sociology. Provides an overview of the historical developments and conceptual aspects of risk Identifies why theorizing on risk is necessary and highlights specific sociological contributions to this field of research Explores key topics including risk society and reflexive modernization, culture and risk, governmentality and risk, systems theory and risk, and edgework and voluntary risk taking Offers a comprehensive look at the promises, pitfalls, and perspectives of risk theorizing","2009-01-22","http://books.google.es/books?id=6BQtAjzmFZYC&printsec=frontcover&dq=intitle:risk&hl=&cd=301&source=gbs_api","9781444301496",
